"id","company_name","company_type","business_status","establishment_date","approval_date","legal_representative","registered_capital","company_size","business_scope","registered_address","business_term","source","taxpayer_identification_number","business_registration_number","organization_code","contact_phone","email","taxpayer_qualification","province","city","district","website_link","industry"
"690","合肥井活园林绿化有限公司","有限责任公司(自然人投资或控股)","存续","1/8/2016","1/8/2016","胡英群","1000000",,"花卉、苗木租赁与销售；绿化养护服务；园林绿化设计、施工。（依法须经批准的项目，经相关部门批准后方可开展经营活动）","合肥市瑶海区大兴镇伏龙村彭东一村民组4号","2016-08-01至无固定期限","马克数据网","91340100MA2MYGKQXD","340100001710055","MA2MYGKQ-X","13956006867","787116553@qq.com",,"安徽省","合肥市","瑶海区",,"林业"
"691","安徽庆联生态农林科技发展有限公司","有限责任公司(自然人投资或控股)","存续","29/5/2015","28/4/2017","郑成玉","10000000",,"生态农业、林业领域内技术开发、转让、咨询与服务；农产品及林产品育苗、种植、运输、销售；植树造林；花卉苗木种植培育；农副产品及林副产品销售；速生丰产林业项目与产业链的开发投资及招商引资；水产品、畜禽养殖（限分支机构）；园林绿化工程；生态旅游项目开发。（依法须经批准的项目，经相关部门批准后方可开展经营活动）","合肥市瑶海区站西路东市残联康复中心1幢集资楼502室","2015-05-29至无固定期限","马克数据网","91340100343904781H","340100001266953","34390478-1","13349012488;15156043263;15603068821;15606032188","15156043263@139.com|97210235@qq.com|97210236@qq.com|80151461@qq.com",,"安徽省","合肥市","瑶海区",,"林业"
"692","合肥骏发园林绿化有限公司","有限责任公司(自然人投资或控股)","存续","4/6/2007","12/9/2016","徐步飞","1650000",,"园林绿化、苗木种植、销售。","安徽省合肥市新站区当涂路江晨园A4号楼408室","2007-06-04至2037-05-24","马克数据网","91340100662915576K","340108000007172","66291557-6","13956958848;13966766966","119816147@qq.com",,"安徽省","合肥市","瑶海区",,"林业"
"693","合肥安盛园林艺术有限公司","有限责任公司(自然人投资或控股)","注销","31/3/2004","19/8/2020","吴斌","500000",,"园林绿化工程，景观设计、施工、管理；花卉、苗木、盆景、花药花肥、机械工具的生产、销售。","安徽省合肥市瑶海区和平路2号华源国际城11号楼3单元505室","2004-03-31至无固定期限","马克数据网","91340100760807288W","340106000023881","76080728-8","13515605146","zhaoning434565@yeah.net|2468530707@qq.com",,"安徽省","合肥市","瑶海区",,"林业"
"694","合肥山木园林工程有限公司","有限责任公司(自然人投资或控股)","存续","18/3/2003","13/6/2011","吴学标","100000",,"花卉、苗木种植、销售、租赁；园林机械、工业化肥、农药、袋装种子销售；园林工程设计、施工、养护。","安徽省合肥市瑶海区漕冲路漕冲批发市场南侧漕冲花园1幢402室","2003-03-18至2030-12-31","马克数据网","91340100746793713R","340100000223275","74679371-3","13965002216","908672529@qq.com|smyl2003@qq.com|870229665@qq.com",,"安徽省","合肥市","瑶海区",,"林业"
"695","合肥市群兴花木生态有限公司","有限责任公司(自然人投资或控股)","注销","24/1/2011","28/6/2021","许高贵","3048000",,"花木栽培、销售；园林绿化工程施工；水产养殖；农产品（除专项审批）销售。","安徽省合肥市新站区磨店乡群治新庄村民组","2011-01-24至2041-01-23","马克数据网","913401005689614536","340108000093243","56896145-3","13605697387","1207595645@qq.com|578071009@qq.com",,"安徽省","合肥市","瑶海区",,"林业"
"696","合肥市兰芳园林绿化有限公司","有限责任公司(自然人独资)","存续","19/8/2015","20/4/2020","黄兵","30000000",,"园林绿化工程设计、施工、养护及技术咨询；土方工程施工；景观工程、市政道路工程、排水工程、古建筑工程、水电安装工程、建筑装饰工程设计与施工；路灯、标识标牌及监控设备安装；凉亭、假山、水池、活动板房、大理石、古建砖雕、石雕、木雕安装；苗圃种植及养护；建筑劳务分包（除劳务派遣）；建筑机械及设备租赁、销售；建筑装饰材料销售。（依法须经批准的项目，经相关部门批准后方可开展经营活动）","合肥市新站区淮海大道以北铜陵北路以东北岗花园7幢2408室","2015-08-19至2035-08-18","马克数据网","913401003532545240","340108000135073","35325452-4","15055106626","2480893816@qq.com",,"安徽省","合肥市","瑶海区",,"林业"
"697","合肥纳瑞斯园林绿化有限公司","有限责任公司(自然人投资或控股)","存续","23/11/2015","23/11/2015","凌德凤","600000",,"景观园林规划、设计、施工；园林绿化养护及信息技术咨询服务；花卉种植、销售、租赁；苗木种植、销售；盆景培植、销售；日用百货销售。（依法须经批准的项目，经相关部门批准后方可开展经营活动）","安徽省合肥市新站区三十头社区合白公路东侧1幢206室","2015-11-23至2045-11-22","马克数据网","91340100MA2MQXAL8L","340108000139331","MA2MQXAL-8","18019595903","1187994166@qq.com",,"安徽省","合肥市","瑶海区",,"林业"
"698","合肥市远大园林有限公司","有限责任公司(自然人投资或控股)","存续","17/4/2017","17/4/2017","朱守有","100000",,"花木、苗木、盆景的种植、养护及批发、零售；绿化设施容器的研发、批发及零售；园林绿化工程施工；水电安装。（依法须经批准的项目，经相关部门批准后方可开展经营活动）","合肥市新站区当涂北路与新海大道交口瑶海家园19幢103室","2017-04-17至无固定期限","马克数据网","91340100MA2NHYPH5M","340108000169716","MA2NHYPH-5","15255456620","1165856381@qq.com|582952749@qq.com",,"安徽省","合肥市","瑶海区",,"林业"
"699","安徽铭杰园林有限公司","有限责任公司(自然人投资或控股)","存续","24/6/2015","26/4/2017","韩宪萍","5000000","小于50人","园林工程、防水工程、室内外装饰工程、建筑幕墙工程设计及施工；铝合金门窗设计、安装；苗木培育及销售；活动板房、净化房、铝合金门窗、彩钢夹芯板、轻钢结构、岩棉板、型钢销售及安装；机电设备安装；非标钢构件安装；板材及装饰材料、建筑材料、钢材销售；钢管租赁。（依法须经批准的项目，经相关部门批准后方可开展经营活动）","安徽省合肥市新站区三十头社区瓦岗社居委八大户组","2015-06-24至2045-06-23","马克数据网","91340100343879598L","340108000132585","34387959-8","13866197146;15956961977;18256077470;18949843006","1741597383@qq.com|18256077470@qq.com|15956961977@qq.com|522568384@qq.com|2356497353@qq.com","一般纳税人","安徽省","合肥市","瑶海区",,"林业"
"700","合肥邦俊苗木有限公司","有限责任公司(自然人投资或控股)","注销","19/4/2010","19/4/2012","许邦俊","30000",,"苗木花果种植、销售。","安徽省合肥市瑶海区长江东路824号","2010-04-19至2030-04-14","马克数据网",,"340100000404572",,,,,"安徽省","合肥市","瑶海区",,"林业"
"701","合肥市瑶海区弈凡鲜花坊","个体工商户","存续","9/5/2023","9/5/2023","张凡",,,"一般项目：树木种植经营；林业产品销售（除许可业务外，可自主依法经营法律法规非禁止或限制的项目）","安徽省合肥市瑶海区龙岗开发区圣地雅阁小区二期24楼901室","2023-05-09至无固定期限","马克数据网","92340102MA8QE6GH9R","340102601817830","MA8QE6GH-9",,,,"安徽省","合肥市","瑶海区",,"林业"
"702","合肥中林农业科技有限公司","有限责任公司(自然人投资或控股)","注销","8/12/2006","26/1/2021","张寿勇","1300000",,"苗木花卉种植、销售；家禽、家畜饲养、销售。","安徽省合肥市长江东路纺机厂3#-4#楼西边四号","2006-12-08至2026-12-07","马克数据网","91340100MA8LG1L55Y","3401002033485","MA8LG1L5-5",,,,"安徽省","合肥市","瑶海区",,"林业"
"703","合肥瑶海区百绿园花木场","个体工商户","存续","26/12/2012","27/9/2016","袁祖明","8",,"花木租赁；园林绿化、养护；花木、园艺资材销售；（依法须经批准的项目，经相关部门批准后方可开展经营活动）","合肥瑶海区城东乡东七村三八队","2012-12-26至无固定期限","马克数据网","92340102MA2P9BF91Q","340102600308379","MA2P9BF9-1","0551-64213691;13956989413;18654163075",,,"安徽省","合肥市","瑶海区",,"林业"
"704","合肥瑶海区永春园艺经营部","个体工商户","存续","15/10/2010","20/4/2022","郑进法","100000",,"一般项目：礼品花卉销售；日用陶瓷制品销售；工艺美术品及收藏品批发（象牙及其制品除外）；工艺美术品及收藏品零售（象牙及其制品除外）（除许可业务外，可自主依法经营法律法规非禁止或限制的项目）","安徽省合肥市瑶海区裕丰花市D区7-9号","2010-10-15至无固定期限","马克数据网","92340102MA2P9XW73Q","340102600146805","MA2P9XW7-3","13155171419",,,"安徽省","合肥市","瑶海区",,"林业"
"705","合肥浆乐商贸有限责任公司","有限责任公司(自然人投资或控股)","存续","28/12/2021","28/12/2021","项宏云","1000000",,"一般项目：纸制品销售；纸浆销售；农副产品销售；人工造林；森林经营和管护；森林改培；林产品采集；树木种植经营；竹材采运；花卉种植；水果种植；园艺产品种植；农产品的生产、销售、加工、运输、贮藏及其他相关服务；竹种植；纸制品制造；纸浆制造；初级农产品收购；互联网销售（除销售需要许可的商品）；农业园艺服务；园艺产品销售；橡胶作物种植（除许可业务外，可自主依法经营法律法规非禁止或限制的项目）","安徽省合肥市瑶海区龙岗开发区长江东路九狮水岸A3栋801室","2021-12-28至无固定期限","马克数据网","91340102MA8NJYKT3U","340102000546778","MA8NJYKT-3","18505562920","1069172524@qq.com",,"安徽省","合肥市","瑶海区",,"林业"
"706","合肥瑶海区水春木业经营部","个体工商户","注销","31/5/2012","14/3/2023","吴喜进","50000",,"仿古木材 木材/批零兼营","安徽省合肥市红旗建材市场板材C区10-12西","2012-05-31至无固定期限","马克数据网","92340102MA2PB08N2H","340102600263001","MA2PB08N-2","13856901330;15955166632",,,"安徽省","合肥市","瑶海区",,"林业"
"707","合肥淮丰花木科技有限公司","有限责任公司(自然人独资)","吊销，未注销","14/10/2009","28/12/2011","金苗苗","200000",,"花木繁殖与销售；花木新品种推广；花木种子销售；盆景制作；绿化工程施工及养护；苗木栽培；蔬菜种植；畜禽养殖；农业种植新技术开发、研究。","安徽省合肥市新站区七里塘镇七里塘村龚大塘村民组","2009-10-14至2012-10-13","马克数据网",,"340108000071901",,"15905697753",,,"安徽省","合肥市","瑶海区",,"林业"
"708","合肥雏田花鲜花绿植有限公司","有限责任公司(自然人独资)","注销","21/12/2016","13/6/2019","吴华骏","500000",,"鲜花、绿植、水果、办公用品销售；婚庆服务，婚车租赁；国内广告策划、代理、制作、设计、发布。（依法须经批准的项目，经相关部门批准后方可开展经营活动）","合肥市瑶海区龙岗开发区临泉东路丽水天锦苑13B幢504室","2016-12-21至2066-12-20","马克数据网","91340100MA2N9GD827","340100001860461","MA2N9GD82","18956052942","2351123815@qq.com",,"安徽省","合肥市","瑶海区",,"林业"
"709","合肥市瑶海区七夕花店鲜花店","个体工商户","注销","26/7/2021","24/5/2022","李露露",,,"一般项目：礼品花卉销售；城市绿化管理（除许可业务外，可自主依法经营法律法规非禁止或限制的项目）（依法须经批准的项目，经相关部门批准后方可开展经营活动）","合肥市瑶海区东景苑C2513",,"马克数据网","92340102MA8N1M7M2P","340102601378080","MA8N1M7M2","17333171967",,,"安徽省","合肥市","瑶海区",,"林业"
"710","合肥市瑶海区去雾里鲜花店","个体工商户","存续","28/2/2022","28/2/2022","吴孔银",,,"一般项目：礼品花卉销售；花卉种植；香料作物种植；草种植；农业园艺服务（除许可业务外，可自主依法经营法律法规非禁止或限制的项目）许可项目：林木种子生产经营（依法须经批准的项目，经相关部门批准后方可开展经营活动）","安徽省合肥市瑶海区临泉东路与戚继光交口花溪龙庭商业2幢商101号","2022-02-28至无固定期限","马克数据网","92340102MA8NQAUH1L","340102601504724","MA8NQAUH-1","18956060551",,,"安徽省","合肥市","瑶海区",,"林业"
"711","合肥瑶海区苏红苗木经营部","个体工商户","注销","17/4/2017","27/8/2019","何海峰","10",,"苗木销售；园林绿化养护服务。（依法须经批准的项目，经相关部门批准后方可开展经营活动）","合肥市瑶海区明光路西侧鸣香苑3幢701室",,"马克数据网","92340102MA2NHYCN1R","340102600667943","MA2NHYCN-1",,,,"安徽省","合肥市","瑶海区",,"林业"
"712","合肥市瑶海区派风花卉销售部","个体工商户","存续","23/5/2022","23/5/2022","韩林",,,"一般项目：礼品花卉销售；工艺美术品及礼仪用品销售（象牙及其制品除外）（除许可业务外，可自主依法经营法律法规非禁止或限制的项目）","安徽省合肥市瑶海区三里街街道凤阳东路与天长路交叉口1幢110室","2022-05-23至无固定期限","马克数据网","92340102MA8P2KB50K","340102601564132","MA8P2KB5-0",,,,"安徽省","合肥市","瑶海区",,"林业"
"713","安徽彩色珍稀树木园有限公司","有限责任公司(自然人投资或控股)","注销","26/6/2017","10/9/2018","张琼","5000000",,"珍稀树木、树苗、花卉、盆景的科研、培育、种植及销售；生态园林开发；园林休闲观光服务，垂钓服务，娱乐拓展活动策划；园艺、景观、雕塑及仿古建筑设计、施工；园林项目、文化艺术项目投资及信息咨询服务。（依法须经批准的项目，经相关部门批准后方可开展经营活动）","安徽省合肥市瑶海区当涂路325号东城时代广场2幢1502","2017-06-26至2067-06-25","马克数据网","91340100MA2NQGWL2W","340100002007340","MA2NQGWL-2","13335655363","66806299@qq.com",,"安徽省","合肥市","瑶海区",,"林业"
"714","安徽润美生态林业有限公司","有限责任公司(自然人独资)","注销","27/3/2015","14/11/2018","宋心灯","5000000",,"山核桃良种选育、种植、推广、技术服务；绿化工程；农业观光服务；物流配送；坚果、茶叶、森林食品、苗木、木材、木本油料、果树专用肥、农药、粮食、鱼禽类、中药材销售。（依法须经批准的项目，经相关部门批准后方可开展经营活动）","合肥市瑶海区临泉路宝元公寓2幢604号","2015-03-27至2045-03-26","马克数据网","91340100335669179C","340100001216527","33566917-9","13095518425;13345510168","287120633@qq.com",,"安徽省","合肥市","瑶海区",,"林业"
"715","合肥瑶海区恒泰苗木销售部","个体工商户","注销","3/6/2015","14/7/2015","吴红军","500000",,"苗木批发兼零售。（依法须经批准的项目，经相关部门批准后方可开展经营活动）","合肥瑶海区青龙路鸿兴苑8-705","2015-06-03至无固定期限","马克数据网","92340102MA2XKRX705","340102600510433","MA2XKRX7-0",,,,"安徽省","合肥市","瑶海区",,"林业"
"716","合肥市新站区东旭木材经营部","个体工商户","注销","23/6/2009","17/10/2012","杨庆桂","50000",,"木材销售。","安徽省合肥市新站区濉溪路与张洼路交口星海世纪广场C幢1302号","2009-06-23至2013-06-22","马克数据网",,"340108600084231",,,,,"安徽省","合肥市","瑶海区",,"林业"
"717","合肥市瑶海区卢建红花卉经营部","个体工商户","存续","9/5/2022","9/5/2022","卢建红",,,"一般项目：礼品花卉销售；花卉绿植租借与代管理；化肥销售；互联网销售（除销售需要许可的商品）；工艺美术品及收藏品批发（象牙及其制品除外）；日用品批发；林业产品销售；厨具卫具及日用杂品批发；厨具卫具及日用杂品零售（除许可业务外，可自主依法经营法律法规非禁止或限制的项目）","安徽省合肥市瑶海区屯溪路2号裕丰花市一期交易区摊位11号、12号、13号","2022-05-09至无固定期限","马克数据网","92340102MA8P0WEHXC","340102601554887","MA8P0WEH-X",,,,"安徽省","合肥市","瑶海区",,"林业"
"718","合肥瑶海区世明苗木销售部","个体工商户","注销","12/6/2015","8/9/2016","董世明","500000",,"苗木批发兼零售。（依法须经批准的项目，经相关部门批准后方可开展经营活动）","合肥瑶海区青龙路鸿兴苑3-602","2015-06-12至无固定期限","马克数据网","92340102MA2XMC9B09","340102600512412","MA2XMC9B-0","13856008902",,,"安徽省","合肥市","瑶海区",,"林业"
"719","合肥市新站区强胜木业销售部","个体工商户","存续","12/7/2012","12/7/2012","杨广胜","100000",,"装饰板材及配件销售。","安徽省合肥市新站区三十头社区瓦岗社居委塘拐组（合肥益福仓储有限公司）","2012-07-12至无固定期限","马克数据网","92340100MA2PDY9G5M","340108600189739","MA2PDY9G-5","0113-39955555;13034044097;13355609831",,,"安徽省","合肥市","瑶海区",,"林业"
"720","合肥瑶海区香馨园花卉经营部","个体工商户","注销","19/1/2009","26/5/2016","李英芳","800000",,"花卉/零售；园林绿化/服务","安徽省合肥市裕丰花市F区20号",,"马克数据网","92340102MA8LWH52XB","340102600057072","MA8LWH52-X","18055169466",,,"安徽省","合肥市","瑶海区",,"林业"
"721","合肥市瑶海区群坤花卉经营部","个体工商户","存续","11/5/2020","24/4/2022","谢光坤",,,"一般项目：花卉种植（除中国稀有和特有的珍贵优良品种）；礼品花卉销售；园艺产品销售；花卉绿植租借与代管理；厨具卫具及日用杂品批发；厨具卫具及日用杂品零售（除许可业务外，可自主依法经营法律法规非禁止或限制的项目）","合肥市瑶海区裕丰花市D区19-20号",,"马克数据网","92340102MA2UQWQ29N","340102601130867","MA2UQWQ29","13905609928",,,"安徽省","合肥市","瑶海区",,"林业"
"722","安徽物之道贸易有限公司","有限责任公司(自然人投资或控股)","存续","24/6/2020","29/12/2020","田雷俊","5000000",,"日用百货、服装、箱包、鞋帽、化妆品、针纺织品、家用电器、预包装食品、保健食品、酒、饮料、茶叶、电子产品、计算机、通信设备、电子办公设备、办公用品、绘图用品、教学用品、木制品、塑料制品、陶瓷制品、皮革制品、清洁卫生设备及用品、洗护用品、医疗器械(一、二类)、建筑装饰材料（除危险品）、五金、电动工具、汽车配件销售（含网上）；货物或技术进出口（国家禁止或涉及行政审批的货物和技术进出口除外）；建筑工程、园林工程、室内装饰工程设计及施工；国内广告设计、制作、代理、发布；产品设计、服装设计；建筑规划服务。（依法须经批准的项目，经相关部门批准后方可开展经营活动）","安徽省合肥市瑶海区明皇路与吴敬梓路交口奥来园科创中心1号楼2层A203室","2020-06-24至无固定期限","马克数据网","91340102MA2UXYF14B","340102000328620","MA2UXYF1-4","18856261588","18856261588@139.com",,"安徽省","合肥市","瑶海区",,"林业"
"723","合肥市悠美花卉有限公司","有限责任公司(自然人投资或控股)","存续","22/12/2022","22/12/2022","孟洁","1000000",,"一般项目：礼品花卉销售；花卉绿植租借与代管理；礼仪服务；食品销售（仅销售预包装食品）；新鲜水果零售；新鲜蔬菜零售；工艺美术品及收藏品零售（象牙及其制品除外）；城市绿化管理；花卉种植；互联网销售（除销售需要许可的商品）；园林绿化工程施工；会议及展览服务；技术服务、技术开发、技术咨询、技术交流、技术转让、技术推广；租赁服务（不含许可类租赁服务）；工程管理服务；婚庆礼仪服务；工艺美术品及礼仪用品销售（象牙及其制品除外）（除许可业务外，可自主依法经营法律法规非禁止或限制的项目）许可项目：林木种子生产经营（依法须经批准的项目，经相关部门批准后方可开展经营活动，具体经营项目以相关部门批准文件或许可证件为准）","安徽省合肥市瑶海区长江东大街与来安路交口龙湖车桥新界1幢2层204号","2022-12-22至无固定期限","马克数据网","91340102MA8PUF906D",,"MA8PUF90-6","15256056715","15256056715@qq.com",,"安徽省","合肥市","瑶海区",,"林业"
"724","合肥瑶海区景汇花卉经营部","个体工商户","注销","8/5/2014","12/4/2019","韩保平","100000",,"花卉、盆景批发兼零售","合肥瑶海区龙岗临泉东路皇马花园3栋106室",,"马克数据网","92340102MA2PB2KA8L","340102600422305","MA2PB2KA-8",,,,"安徽省","合肥市","瑶海区",,"林业"
"725","合肥森禾规划设计有限公司","有限责任公司(自然人投资或控股)","存续","16/11/2021","16/11/2021","陈文静","500000",,"一般项目：规划设计管理；自然生态系统保护管理；生态资源监测；市场调查（不含涉外调查）；水土流失防治服务；林业机械服务；森林防火服务；林业有害生物防治服务；地理遥感信息服务；园林绿化工程施工；森林经营和管护；林业专业及辅助性活动；林产品采集；树木种植经营；林业产品销售；软件销售（除许可业务外，可自主依法经营法律法规非禁止或限制的项目）","安徽省合肥市瑶海区临泉东路皇马花园36栋403室","2021-11-16至无固定期限","马克数据网","91340102MA8NDWBR12","340102000520093","MA8NDWBR-1","13770569203","13770569203@163.com",,"安徽省","合肥市","瑶海区",,"林业"
"726","合肥月季玉器有限公司","有限责任公司(自然人独资)","注销","10/12/2014","10/8/2018","李兴桦","10000000",,"玉器、玛瑙、翡翠、彩宝、金镶玉销售。（依法须经批准的项目，经相关部门批准后方可开展经营活动）","合肥市瑶海区凤台路银河新城31#704室","2014-12-10至无固定期限","马克数据网","913401003254200463","340100001153737","32542004-6","15605692666","1716571062@qq.com",,"安徽省","合肥市","瑶海区",,"林业"
"727","合肥市瑶海区美莳园园艺店","个体工商户","存续","17/5/2023","17/5/2023","顾圣杰",,,"一般项目：花卉种植；园艺产品种植；园艺产品销售；农业园艺服务（除许可业务外，可自主依法经营法律法规非禁止或限制的项目）","安徽省合肥市瑶海区枞阳路301号仙居苑18栋401","2023-05-17至无固定期限","马克数据网","92340102MA8QFDLKXT","340102601826966","MA8QFDLK-X",,,,"安徽省","合肥市","瑶海区",,"林业"
"728","合肥瑶海区满园春花店","个体工商户","注销","18/7/2005","1/12/2009","童来凤","5000",,"花草.盆景/零售","安徽省合肥市裕丰花市E-6号","2005-07-18至无固定期限","马克数据网",,"3401023015614",,,,,"安徽省","合肥市","瑶海区",,"林业"
"729","合肥蓝莲鲜花绿植有限公司","有限责任公司(自然人独资)","注销","25/4/2019","26/10/2020","柯彩年","30080000",,"鲜花、绿植销售及租赁；婚庆策划服务；展览展示服务；庆典会场策划及布置；园艺花卉种植技术咨询。（依法须经批准的项目，经相关部门批准后方可开展经营活动）","安徽省合肥市瑶海区龙岗开发区新站居委会长江东路80号朱小郢1幢","2019-04-25至无固定期限","马克数据网","91340100MA2TN8960D","340100002198090","MA2TN896-0","18956052942","2880673132@qq.com",,"安徽省","合肥市","瑶海区",,"林业"
"730","合肥瑶海区瑞丰花卉经营部","个体工商户","吊销，未注销","6/8/2010","16/12/2011","费瑞忠","20000",,"花卉/销售","安徽省合肥市瑶海区勤居苑东区门面房38号","2010-08-06至无固定期限","马克数据网",,"340102600139556",,,,,"安徽省","合肥市","瑶海区",,"林业"
"731","合肥市瑶海区鲜岑花卉经营部","个体工商户","存续","4/12/2020","4/12/2020","吴克宏",,,"花卉、绿植、盆景、苗木、水产品、水果、蔬菜销售。（依法须经批准的项目，经相关部门批准后方可开展经营活动）","安徽省合肥市瑶海区北一环路与蚌山路交口中州世纪广场A座503室","2020-12-04至无固定期限","马克数据网","92340102MA2WGHYBX5","340102601253939","MA2WGHYB-X",,,,"安徽省","合肥市","瑶海区",,"林业"
