"company_name","business_status","legal_representative","registered_capital","paid_in_capital","establishment_date","approval_date","business_term","province","city","district","phone","additional_phones","email","additional_emails","unified_social_credit_code","taxpayer_identification_number","business_registration_number","organization_code","insured_personnel_count","company_type","industry","former_name","registered_address","latest_annual_report_address","website","business_scope","match_status"
"安徽山之名建设工程有限公司","开业","吴新海","50000000","0","15/11/2018 00:00:00","30/6/2023 00:00:00","-","安徽省","合肥市","肥西县","17333098079","18788886565,0551-65535886,0551-63820168,13866748713","573257886@qq.com","1027896440@qq.com","91340104MA2T89BR6K","91340104MA2T89BR6K","340104000245451","MA2T89BR-6","0","有限责任公司(自然人投资或控股)","建筑装饰、装修和其他建筑业","-","安徽省合肥市肥西县桃花镇翠竹路文一名门御府S1商铺三楼","安徽省合肥市包河区上海路188号中建智立方2期B座12A","www.ahszm.com","建筑工程、市政公用工程、园林绿化工程、公路工程、水利水电工程、河湖整治工程、建筑装修装饰工程、建筑幕墙工程、防水防腐保温工程、钢结构工程、城市及道路照明工程、环保工程、古建筑工程、机电工程、电力工程、消防设施工程、建筑机电安装工程、体育场地设施工程、电子与智能化工程、输变电工程、地基基础工程、土石方工程、机场场道工程、通信工程、桥梁工程、隧道工程、城市轨道交通工程、地下管廊工程的设计及施工；雨污水管道检测清理；水环境处理；土地治理与开发；水电及空调安装；机械设备租赁；建筑材料销售；黄砂、石子开采与销售；建筑劳务分包（除劳务派遣）。（依法须经批准的项目，经相关部门批准后方可开展经营活动）","成功"
"合肥康达工程咨询有限责任公司","开业","宫张宁","10000000","10000000","31/8/1995 00:00:00","3/1/2024 00:00:00","-","安徽省","合肥市","蜀山区","0551-5326124","0551-5326134,0551-5313925,13905644850,13965001797,15856395381","453670308@qq.com","kangdajianli@126.com","91340100149043586L","91340100149043586L","340106000003531","14904358-6","206","有限责任公司(自然人投资或控股)","软件和信息技术服务业","合肥康达工程建设监理有限责任公司","安徽省合肥市高新区天智路5号同创科技园6幢5楼","合肥市高新区天智路5号6幢5楼","www.hfkdzx.com","许可项目：建设工程监理（依法须经批准的项目，经相关部门批准后方可开展经营活动，具体经营项目以相关部门批准文件或许可证件为准）一般项目：工程管理服务；工程造价咨询业务；招投标代理服务；非居住房地产租赁（除许可业务外，可自主依法经营法律法规非禁止或限制的项目）","成功"
"安徽省中畅生态工程建设有限公司","开业","鲍习霞","20600000","20600000","11/1/2008 00:00:00","10/7/2019 00:00:00","2008-01-11 至 2038-01-11","安徽省","合肥市","巢湖市","0551-63450007","18056395198,0551-62633103,0551-63400050,13856551112,17305608487","bxz7320@qq.com","-","9134018167092419XN","9134018167092419XN","341402000006521","67092419-X","33","有限责任公司(自然人投资或控股)","建筑装饰、装修和其他建筑业","安徽省中畅工程建设有限公司","巢湖市烔炀镇工业区合芜公路32.9KM处5幢","安徽省合肥市九华山路1号世纪阳光大厦1101室","www.ahzc0007.com","建筑工程、防水防腐保温工程、地基与基础工程、钢结构工程、公路工程施工与养护、公路交通工程、桥梁工程施工与维护加固、隧道工程、石油化工工程、古建筑工程、市政公用工程、水利水电工程、机电安装工程、河湖整治工程、堤防工程、水工大坝工程、输变电工程（不含承装（修、试）电力设施）、通信工程、城市及道路照明工程、环保工程设计与施工、环保及交通工程设备制造安装与销售、大棚制作安装及配套加工销售、园林绿化工程与养护、园林花卉种植与施工养护、特种专业工程（不含特种设备）、地质灾害治理勘察设计施工、装饰装修设计与施工、建筑幕墙工程、电子智能化工程、消防设施工程设计与施工、建筑教学模型技术开发、展览陈列工程设计与施工、雕塑设计及施工、招标代理、工程咨询与设计、造价审计、施工劳务、物业管理、卫生保洁、广告标牌、房屋拆除、档案资料整理。（依法须经批准的项目，经相关部门批准后方可开展经营活动）","成功"
"惠特科学技术有限公司","开业","赵玉","65190000","9778500","8/9/2006 00:00:00","25/12/2023 00:00:00","-","安徽省","合肥市","蜀山区","021-54293538","021-54150198,0551-63801130,13916646279,0551-63801118,0571-63081118","3270847503@qq.com","3459833994@qq.com,3078274974@qq.com,292183635@qq.com,1952395894@qq.com,huite-20060908@163.com,1952394894@qq.com","913401007935614488","913401007935614488","340108000043865","79356144-8","100","有限责任公司(自然人投资或控股)","家具制造业","惠特环境科技有限公司","合肥市蜀山区潜山路190号华邦世贸中心超高写字楼1605室","合肥市蜀山区潜山路190号华邦世贸中心超高写字楼1605室","www.htkxjs.com","环保设备、实验室设备、实验室台柜、通风柜、钢制家具、实验室家具、办公家具、酒店家具、学校家具、档案库房家具、医院家具、医疗器械的设计、研发、生产、销售、安装施工一体化；空气净化设备、自动化控制设备、实验室仪器耗材的研发、销售；实验室整体建设与改造的咨询、设计、施工及验收服务；实验室认证、维修保养的咨询与服务；实验室通风及供气工程、自动化控制工程、洁净（净化）工程、恒温恒湿工程、机电安装工程、环保工程、建筑装饰装修工程（建筑幕墙工程除外）、智能化工程、消防工程、纯水工程、冷库工程及安全技术防范工程的设计、施工。（依法须经批准的项目，经相关部门批准后方可开展经营活动）","成功"
"合肥工大建设监理有限责任公司","开业","张勇","6000000","6000000","25/5/1995 00:00:00","14/1/2022 00:00:00","-","安徽省","合肥市","包河区","0551-62901621","0556-2919562,13966780988,13965146939,0551-82366822,34001927","hfutcsc@163.com","-","913401001491893071","913401001491893071","340100000041564","14918930-7","1173","有限责任公司(国有控股)","居民服务业","-","合肥市包河经济开发区花园大道369号","合肥市包河经济开发区花园大道369号","hfutcsc.hfut.edu.cn","许可项目：建设工程监理；公路工程监理；水利工程建设监理；工程造价咨询业务；单建式人防工程监理（依法须经批准的项目，经相关部门批准后方可开展经营活动）一般项目：工程管理服务；招投标代理服务；业务培训（不含教育培训、职业技能培训等需取得许可的培训）；技术服务、技术开发、技术咨询、技术交流、技术转让、技术推广（除许可业务外，可自主依法经营法律法规非禁止或限制的项目）","成功"
"合肥讯达工程咨询有限公司;安徽省新同济工程咨询集团有限公司","-","-","0","0","1/1/1970 00:00:00","1/1/1970 00:00:00","-","-","-","-","-","-","-","-","-","-","-","-","-","-","-","-","-","-","-","-","失败"
"机械工业勘察设计研究院有限公司","开业","杨永林","105000000","105000000","23/2/1989 00:00:00","1/3/2022 00:00:00","-","陕西省","西安市","新城区","029-83498900","029-83252292,19929368528,13572422934,18092392288,13572586421","jkjy@jk.com.cn","-","9161000022052202XH","9161000022052202XH","610000000013831","22052202-X","547","有限责任公司(非自然人投资或控股的法人独资)","专业技术服务业","机械工业部勘察研究院","陕西省西安市新城区咸宁中路51号","西安市新城区咸宁中路51号","www.jkyzhyq.com","工程设计与咨询；工程总承包及项目管理；工程监理；城乡规划、旅游规划、土地规划设计与咨询；岩土工程勘察、设计、试验、检测；工程测量与监测、摄影测量与遥感、海洋测绘、不动产测绘与地理信息系统；地质灾害评估、勘查、设计、监理；水文地质、工程地质、环境地质调查与勘查；土地整理；水资源论证与固体矿产勘查；环境影响评价、环境污染治理工程；文物保护工程勘察设计与监理；工程物资及设备销售与租赁；房屋租赁。（依法须经批准的项目，经相关部门批准后方可开展经营活动）","成功"
"安徽建工三建集团有限公司","开业","何洪春","1320000000","1320000000","16/9/2002 00:00:00","2/2/2024 00:00:00","-","安徽省","合肥市","包河区","13956947714","18654165231,15956960511,15955145136,18256950627,18256585205","-","-","91340000743076866A","91340000743076866A","340000000021149","74307686-6","2450","有限责任公司(国有控股)","房屋建筑业","-","安徽省合肥市包河区芜湖路329号","安徽省合肥市包河区芜湖路329号","www.sjah.com.cn","房屋建筑工程、建筑装修装饰工程、机电设备安装工程、起重设备安装工程、市政公用工程、公路工程、水利水电工程、公路路面及路基工程施工，园林绿化，建筑工程勘探设计，工程咨询，承包境外房屋建筑工程和境内国际招标工程，上述境外工程所需的设备、材料出口，对外派遣实施上述境外工程所需要的劳务人员，机械设备、房屋租赁。（依法须经批准的项目，经相关部门批准后方可开展经营活动）","成功"
"安徽建工集团股份有限公司","开业","李有贵","1716533938","1716533900","15/6/1998 00:00:00","14/11/2022 00:00:00","-","安徽省","蚌埠市","禹会区","025-58373077","0552-3950586,023-67735119,0551-62865038,0552-3067136,0551-62865085","ahjgzqb@163.com","ahsj070@163.com","91340300711790416H","91340300711790416H","340000000010716","71179041-6","18573","其他股份有限公司(上市)","土木工程建筑业","安徽水利开发股份有限公司","安徽省蚌埠市东海大道5183号","安徽省合肥市蜀山区黄山路459号安建国际大厦","www.aceg.com.cn","建筑工程施工、水利水电工程施工、公路工程施工、市政公用工程施工、港口与航道工程施工、机电工程施工；公路路基工程、公路路面工程、桥梁工程、隧道工程、城市园林绿化工程、河湖整治工程、钢结构工程、建筑装修装饰工程、建筑幕墙工程、消防设施工程、建筑机电安装工程、起重设备安装工程；基础设施及环保项目投资、运营；水利水电资源开发；房地产开发；对外工程承包、货物或技术的进出口业务（国家禁止或涉及行政审批的货物和技术进出口除外）；金属结构加工、制作、安装；工程勘察、规划、设计、咨询，建筑工程和交通工程的研发、咨询、检测、监理。（依法须经批准的项目，经相关部门批准后方可开展经营活动）","成功"
"尚纬股份有限公司","开业","李广胜","621527586","200000000","7/7/2003 00:00:00","11/1/2022 00:00:00","-","四川省","乐山市","市中区","13833259888","13666198820,0833-2450114,13540543680,0871-3115533,0755-25845183","sunway@sunwayint.com","mxdl@mxdlgroup.cn","915111007523025620","915111007523025620","511100000010378","75230256-2","818","股份有限公司(上市、自然人投资或控股)","电气机械和器材制造业","四川明星电缆股份有限公司","四川省乐山高新区迎宾大道18号","四川省乐山高新区迎宾大道18号","www.starcable.com.cn","生产、加工、销售、研发、设计：电线、电缆、加热电器；电缆桥架、电缆附件；经营本企业自产产品的出口业务；经营本企业生产所需的原辅材料，仪器仪表，机械设备及配件的进出口业务（国家限制经营和禁止进出口的商品除外）；收购包装物木材；电气安装；电气设备批发；信息技术咨询服务；检测服务、技术推广服务；贸易代理；金属丝绳及其制品制造。（依法须经批准的项目，经相关部门批准后方可开展经营活动）","成功"
"合肥鑫伟电力设备有限公司","开业","李世权","100010000","50000000","16/3/2004 00:00:00","10/12/2020 00:00:00","-","安徽省","合肥市","长丰县","0551-66392111","0551-65689685,0551-66393111,15156095791,0551-65689686,0554-3311810","1490794328@qq.com","2638065330@qq.com,727992583@qq.com,265370096@qq.com,2653470096@qq.com,184493094@qq.com,119859456@qq.com","9134012175854559XM","9134012175854559XM","340121000030860","75854559-X","41","有限责任公司(自然人投资或控股)","电气机械和器材制造业","-","安徽省合肥市双凤工业区","长丰县金泰路17号","www.ahxinwei.com","电力变压器、箱式变电站、特种变压器、电抗器及高低压成套设备的设计、生产、销售。","成功"
"安徽省池州市九华工程咨询有限公司","开业","王劲松","6000000","1034000","7/7/2006 00:00:00","12/4/2024 00:00:00","-","安徽省","池州市","贵池区","0566-5031016","13225719533,13965911207,13063298989,0566-2617878","335076137@qq.com","1052849889@qq.com,993720367@qq.com","91341700790133632M","91341700790133632M","341700000009664","79013363-2","0","有限责任公司(自然人独资)","商务服务业","-","安徽省池州市贵池区长江南路和谐公馆1007-1009","安徽省池州市贵池区长江南路和谐公馆1007","www.jhgczx.cn","一般项目：水利相关咨询服务；工程管理服务；工程造价咨询业务；招投标代理服务；企业管理咨询；水土流失防治服务；环保咨询服务；安全咨询服务；环境保护监测；消防技术服务；技术服务、技术开发、技术咨询、技术交流、技术转让、技术推广；水文服务；市政设施管理；城市绿化管理；土地整治服务；企业管理；环境应急治理服务；水污染治理；对外承包工程；承接总公司工程建设业务；灌溉服务；园林绿化工程施工；税务服务（除许可业务外，可自主依法经营法律法规非禁止或限制的项目）许可项目：水利工程建设监理（依法须经批准的项目，经相关部门批准后方可开展经营活动，具体经营项目以相关部门批准文件或许可证件为准）","成功"
"安徽省禹顺水利工程管理有限公司","开业","刘晓波","10000000","2000000","6/3/2001 00:00:00","2/9/2021 00:00:00","-","安徽省","合肥市","包河区","0551-65506685","0551-63625431,0551-62629968,0551-65506673,0551-65506638,0551-65506652","ahsljlzx@126.com","ahsljsfwzx@163.com,ahhczx@126.com","913400007117038106","913400007117038106","340000000024042","71170381-0","146","有限责任公司(非自然人投资或控股的法人独资)","商务服务业","-","安徽省合肥市滨湖区徽州大道6669号滨湖时代广场C3幢20层","安徽省合肥市滨湖区徽州大道6669号滨湖时代广场C3幢20层","www.ahsljl.com","水利工程建设监理；公路工程监理；建设工程监理（依法须经批准的项目，经相关部门批准后方可开展经营活动）工程管理服务（除许可证外，可自主依法经营法律法规非禁止或限制的项目）","成功"
"安徽同方工程咨询有限公司","开业","胡军庆","5000000","5000000","26/4/2000 00:00:00","16/4/2024 00:00:00","-","安徽省","六安市","金安区","13905649887","13705647138,18956288813,0564-6081190,13339119943,0564-6017112","-","-","91341500729994089P","91341500729994089P","341500000024345","72999408-9","53","有限责任公司(自然人投资或控股)","商务服务业","六安市同方建设监理咨询有限责任公司","安徽省六安市金安区人民路青年广场阳光大厦商住楼105、205铺","安徽省六安经济开发区上东阳光城六号楼五楼503室","www.ahtf.vip","房屋建筑工程监理；市政公用工程监理；水利水电工程监理；公路工程监理；人民防空工程监理；房屋建筑工程施工总承包；市政公用工程施工总承包；城市园林绿化工程施工总承包；水利水电工程施工总承包；公路工程施工总承包；机电工程施工总承包；建筑装修装饰工程专业承包；古建筑工程专业承包；建筑幕墙工程专业承包；城市及道路照明工程专业承包；地基基础工程专业承包；起重设备安装工程专业承包；钢结构工程专业承包；环保工程专业承包；消防设施工程专业承包；建筑机电安装工程专业承包；施工劳务专业承包；绿化管理；工程造价咨询；招标代理；政府采购代理；水利水电、建筑编议书制作；可研编制；招标咨询；工程咨询；工程项目管理；水土保持方案编制、监测及验收。（依法须经批准的项目，经相关部门批准后方可开展经营活动）","成功"
"中南建设集团有限公司","开业","申志刚","1017920000","84778100","25/3/1985 00:00:00","8/2/2023 00:00:00","-","湖南省","长沙市","天心区","023-53333796","0731-85593266,0738-8360207,0731-82961175,0731-82961067,0731-84417887","270967547@qq.com","znsz@163.com","91430000185021659F","91430000185021659F","430000000019862","18502165-9","496","其他有限责任公司","土木工程建筑业","中南市政建设集团股份有限公司","长沙市天心区劳动西路256号江山资源大厦28-30楼","长沙市天心区劳动西路256号江山资源大厦","www.znjsjt.com","许可项目：建设工程施工；公路管理与养护（依法须经批准的项目，经相关部门批准后方可开展经营活动，具体经营项目以相关部门批准文件或许可证件为准）一般项目：对外承包工程；货物进出口；技术进出口；以自有资金从事投资活动；非居住房地产租赁；机械设备租赁；酒店管理；自有资金投资的资产管理服务（除依法须经批准的项目外，凭营业执照依法自主开展经营活动）。","成功"
"宜兴市交通建设集团有限公司","开业","芮宣","500000000","47000000","3/4/1993 00:00:00","21/12/2023 00:00:00","-","江苏省","无锡市","宜兴市","15961500707","0510-8793976,0510-87126816,18001536653,0510-67905244,0510-87126800","yxjtjsjtcom@163.com","yxjtjsjt@163.com","913202822504631472","913202822504631472","320282000019514","25046314-7","377","有限责任公司(非自然人投资或控股的法人独资)","土木工程建筑业","宜兴市交通工程总公司","宜兴经济技术开发区边庄村","宜兴经济开发区边庄村","www.yxjtjsjt.com","许可项目：建设工程施工；建筑劳务分包（依法须经批准的项目，经相关部门批准后方可开展经营活动，具体经营项目以审批结果为准）一般项目：港口货物装卸搬运活动；园林绿化工程施工；城市绿化管理（除依法须经批准的项目外，凭营业执照依法自主开展经营活动）","成功"
"安徽合巢建设工程管理有限公司","开业","强军","20100000","2000000","1/12/2015 00:00:00","12/5/2021 00:00:00","-","安徽省","合肥市","巢湖市","0551-63400050","0556-4967802,18119627957,0551-63400031,0551-63400032","zhc7320@qq.com","576242912@qq.com","91340181MA2MR3209U","91340181MA2MR3209U","340181000010897","MA2MR320-9","22","有限责任公司(自然人独资)","商务服务业","-","巢湖市烔炀镇烔黄路东侧原烔炀派出所","安徽省合肥市包河区马鞍山南路299号铂金汉宫9幢404室","www.ahhc0032.com","建筑工程、防水防腐保温工程、地基与基础工程、钢结构工程、公路工程施工与养护、公路交通工程、桥梁工程施工与维护加固、隧道工程、石油化工工程、古建筑工程、市政公用工程、水利水电工程、机电安装工程、河湖整治工程、堤防工程、水工大坝工程、输变电工程（不含承装（修、试）电力设施）、通信工程、城市及道路照明工程、环保工程设计与施工、环保及交通工程设备制造安装与销售、大棚制作安装及配套加工销售、园林绿化工程与养护、园林花卉种植与施工养护、特种专业工程（不含特种设备）、地质灾害治理勘察设计施工、装饰装修设计与施工、建筑幕墙工程、电子智能化工程、消防设施工程设计与施工、建筑教学模型技术开发、展览陈列工程设计与施工、雕塑设计及施工、招标代理、工程咨询与设计、造价审计、施工劳务、物业管理、卫生保洁、广告标牌、房屋拆除、档案资料整理。（依法须经批准的项目，经相关部门批准后方可开展经营活动）","成功"
"安徽寰宇建筑设计院;安徽省金田建筑设计咨询有限责任公司","-","-","0","0","1/1/1970 00:00:00","1/1/1970 00:00:00","-","-","-","-","-","-","-","-","-","-","-","-","-","-","-","-","-","-","-","-","失败"
"中建八局西南建设工程有限公司;安徽老乡鸡餐饮股份有限公司","-","-","0","0","1/1/1970 00:00:00","1/1/1970 00:00:00","-","-","-","-","-","-","-","-","-","-","-","-","-","-","-","-","-","-","-","-","失败"
"安徽省建筑工程质量监督检测站有限公司","开业","罗居刚","10000000","10000000","27/3/2006 00:00:00","1/4/2024 00:00:00","-","安徽省","合肥市","蜀山区","18297923376","0551-65771157,0551-65771159,13695653420,0551-62623180,15856982757","JCZAH@vip.163.com","78274198@qq.com,jczah@vip.163.com,641147074@qq.com","91340000786533748U","91340000786533748U","340000000019223","78653374-8","173","有限责任公司(非自然人投资或控股的法人独资)","专业技术服务业","-","安徽省合肥市高新技术开发区红枫路55号","安徽省合肥市高新技术开发区红枫路55号","-","许可项目：建设工程质量检测；水利工程质量检测；室内环境检测；雷电防护装置检测；检验检测服务；建设工程勘察；测绘服务；安全评价业务；司法鉴定服务；特种设备检验检测；职业卫生技术服务；安全生产检验检测；农产品质量安全检测（依法须经批准的项目，经相关部门批准后方可开展经营活动，具体经营项目以相关部门批准文件或许可证件为准）一般项目：公路水运工程试验检测服务；消防技术服务；工程造价咨询业务；工程和技术研究和试验发展；水环境污染防治服务；计量技术服务；市政设施管理；水污染治理；业务培训（不含教育培训、职业技能培训等需取得许可的培训）；生态资源监测；噪声与振动控制服务；工程管理服务；信息技术咨询服务；环境保护监测（除许可业务外，可自主依法经营法律法规非禁止或限制的项目）","成功"
"中国铁建大桥工程局集团有限公司","开业","罗生宏","3200000000","3200000000","10/5/1988 00:00:00","18/1/2024 00:00:00","-","天津市","市辖区","滨海新区","15566215755","0731-28372036,18348556319,13681148382,18105849693,022-88958864","-","-","91120116244997951G","91120116244997951G","120192000083682","24499795-1","12763","有限责任公司(法人独资)","土木工程建筑业","中国铁建十三局集团有限公司","天津自贸试验区（空港经济区）中环西路32号","天津自贸试验区（空港经济区）中环西路32号","cr13g.crcc.cn","许可项目：建设工程施工；建设工程设计；建设工程勘察；公路管理与养护；爆破作业；地质灾害治理工程施工；国内船舶管理业务；房地产开发经营；船舶修理；船舶改装；输电、供电、受电电力设施的安装、维修和试验；水力发电；发电业务、输电业务、供（配）电业务；电气安装服务；非煤矿山矿产资源开采；特种设备安装改造修理。（依法须经批准的项目，经相关部门批准后方可开展经营活动，具体经营项目以相关部门批准文件或许可证件为准）。一般项目：工程管理服务；工程和技术研究和试验发展；园林绿化工程施工；水污染治理；船舶销售；船舶租赁；船舶拖带服务；船舶港口服务；建筑材料销售；新型建筑材料制造（不含危险化学品）【分支机构经营】；砼结构构件制造【分支机构经营】；砼结构构件销售；水泥制品销售；对外承包工程；住房租赁；机械设备租赁；海洋能系统与设备制造【分支机构经营】；固体废物治理；选矿；新能源原动设备销售；专用设备修理；技术进出口；货物进出口；非居住房地产租赁；土地使用权租赁；物业管理。（除依法须经批准的项目外，凭营业执照依法自主开展经营活动）","成功"
"安徽宏志建设集团有限公司;安徽庆宇建设工程有限公司","-","-","0","0","1/1/1970 00:00:00","1/1/1970 00:00:00","-","-","-","-","-","-","-","-","-","-","-","-","-","-","-","-","-","-","-","-","失败"
