"id","company_name","company_type","business_status","establishment_date","approval_date","legal_representative","registered_capital","company_size","business_scope","registered_address","business_term","source","taxpayer_identification_number","business_registration_number","organization_code","contact_phone","email","taxpayer_qualification","province","city","district","website_link","industry"
"231","安徽隆怀生态农业科技有限公司","有限责任公司(自然人投资或控股)","存续","26/8/2014","19/5/2016","汪龙怀","1000000",,"农业技术开发和技术转让；生态旅游资源开发，农副产品销售；农林开发及树木种植、农业信息咨询服务；生态养生及旅游项目开发。","合肥市瑶海区临泉路香格里拉花园国际中心办1005","2014-08-26至2044-08-25","马克数据网","91340100395692741K","340100001066939","39569274-1","18256958915;18755188007;18756459888","2880673131@qq.com|2885177568@qq.com|2880673139@qq.com|2880673134@qq.com|2880673837@qq.com|2880673137@qq.com",,"安徽省","合肥市","瑶海区",,"农业"
"232","合肥市新站区荷花塘莲藕种植中心","个体工商户","存续","2/9/2013","2/9/2013","刘庆文","100000",,"莲藕种植。","安徽省合肥市新站区三十头社区卫岗村陆小西组","2013-09-02至无固定期限","马克数据网","92340100MA2PEDWX98","340108600202798","MA2PEDWX-9","13955136289",,,"安徽省","合肥市","瑶海区",,"农业"
"233","合肥市瑶海区新艺精灵花鲜花店","个体工商户","存续","12/4/2022","12/4/2022","刘月香",,,"一般项目：礼品花卉销售；花卉种植（除中国稀有和特有的珍贵优良品种）；花卉种植；水产品零售；食用农产品初加工（除许可业务外，可自主依法经营法律法规非禁止或限制的项目）","安徽省合肥市瑶海区龙岗开发区临泉路王岗华凌菜市场门口b1-b2号","2022-04-12至无固定期限","马克数据网","92340102MA8NXKAY92","340102601538688","MA8NXKAY-9","13178153360",,,"安徽省","合肥市","瑶海区",,"农业"
"234","合肥市瑶海区田辛花卉工作室","个体工商户","存续","17/6/2021","17/6/2021","潘剑波",,,"许可项目：餐饮服务（不产生油烟、异味、废气）；餐饮服务（依法须经批准的项目，经相关部门批准后方可开展经营活动）一般项目：礼品花卉销售；花卉绿植租借与代管理（除许可业务外，可自主依法经营法律法规非禁止或限制的项目）","合肥市瑶海区嘉山路街道大众时代之光1＃2301","2021-06-17至无固定期限","马克数据网","92340102MA8LM8FD4T","340102601355583","MA8LM8FD-4",,,,"安徽省","合肥市","瑶海区",,"农业"
"235","安徽老屠薯业有限公司","有限责任公司(自然人投资或控股)","注销","20/4/2017","8/12/2017","屠国军","5000000",,"红薯、紫薯、蔬菜销售。（依法须经批准的项目，经相关部门批准后方可开展经营活动）","合肥市瑶海区龙岗开发区华顺九狮水岸D8幢304室","2017-04-20至2047-04-19","马克数据网","91340100MA2NJDP18B","340100001955821","MA2NJDP1-8",,,,"安徽省","合肥市","瑶海区",,"农业"
"236","合肥市瑶海区新艺花店鲜花店","个体工商户","存续","28/7/2021","28/7/2021","黄芳芝",,,"一般项目：礼品花卉销售；花卉绿植租借与代管理（除许可业务外，可自主依法经营法律法规非禁止或限制的项目）（依法须经批准的项目，经相关部门批准后方可开展经营活动）","合肥市瑶海区王岗路华凌菜市场B042、B043","2021-07-28至无固定期限","马克数据网","92340102MA8N1XQDXD","340102601379687","MA8N1XQD-X","13798588152",,,"安徽省","合肥市","瑶海区",,"农业"
"237","合肥瑶海区花间蜜语花店","个体工商户","存续","20/11/2010","25/4/2022","吴万水","10000",,"一般项目：礼品花卉销售；花卉绿植租借与代管理；厨具卫具及日用杂品批发；互联网销售（除销售需要许可的商品）；园艺产品销售（除许可业务外，可自主依法经营法律法规非禁止或限制的项目）","合肥市瑶海区屯溪路2号合肥裕丰花市A区-11号","2010-11-20至无固定期限","马克数据网","92340102MA2P9BRW6L","340102600153659","MA2P9BRW-6","13305518775;15155512581",,,"安徽省","合肥市","瑶海区",,"农业"
"238","安徽亨纳农业发展有限公司","有限责任公司(自然人投资或控股)","存续","14/10/2022","14/10/2022","尹若川","50000000",,"一般项目：农产品的生产、销售、加工、运输、贮藏及其他相关服务；农业生产资料的购买、使用；粮食收购；食用农产品批发；农产品智能物流装备销售；国内贸易代理；新鲜水果批发；初级农产品收购；农副产品销售（除许可业务外，可自主依法经营法律法规非禁止或限制的项目）","安徽省合肥市瑶海区当涂路325号东城时代广场1幢办公楼商业B座2010-02","2022-10-14至无固定期限","马克数据网","91340100MA8PKBWE1G","340100002232359","MA8PKBWE-1",,,,"安徽省","合肥市","瑶海区",,"农业"
"239","合肥市瑶海区稳遇檀农副产品经营部","个体工商户","存续","4/7/2022","4/7/2022","洪锡强","30000",,"一般项目：农副产品销售；林业产品销售；谷物销售；豆及薯类销售；园艺产品种植；蔬菜种植；花卉种植（除中国稀有和特有的珍贵优良品种）；树木种植经营；农业专业及辅助性活动；食用农产品零售；新鲜水果零售；新鲜蔬菜零售；水产品零售；食品销售（仅销售预包装食品）；日用百货销售；日用品销售（除许可业务外，可自主依法经营法律法规非禁止或限制的项目）许可项目：农作物种子经营；食用菌菌种经营；林木种子生产经营（依法须经批准的项目，经相关部门批准后方可开展经营活动，具体经营项目以相关部门批准文件或许可证件为准）","安徽省合肥市瑶海区铜陵路铜陵东村30栋105室","2022-07-04至无固定期限","马克数据网","92340102MA8P7FXL5J","340102601587635","MA8P7FXL-5",,,,"安徽省","合肥市","瑶海区",,"农业"
"240","合肥瑶海区家雨花店","个体工商户","存续","15/1/2018","15/1/2018","沈家力","8",,"鲜花销售。（依法须经批准的项目，经相关部门批准后方可开展经营活动）","合肥市瑶海区漕冲小区9号楼101门面","2018-01-15至无固定期限","马克数据网","92340102MA2RFN6AXG","340102600768891","MA2RFN6A-X","15155175865",,,"安徽省","合肥市","瑶海区",,"农业"
"241","合肥瑶海区世勇花店","个体工商户","存续","18/1/2017","18/1/2017","邵世勇","5000",,"鲜花销售；（依法须经批准的项目，经相关部门批准后方可开展经营活动）","合肥市瑶海区凤阳东路花冲苑13幢","2017-01-18至无固定期限","马克数据网","92340102MA2NBFFT5G","340102600650124","MA2NBFFT-5","13856016744",,,"安徽省","合肥市","瑶海区",,"农业"
"242","张勇","个体工商户","注销","23/4/2019","18/5/2022","张勇",,,"销售服装，（依法须经批准的项目，经相关部门批准后方可开展经营活动）","合肥市瑶海区长淮新村A区2幢103",,"马克数据网","92340102MA2TMUBGX8","340102600952747","MA2TMUBGX","13721078570",,,"安徽省","合肥市","瑶海区",,"农业"
"243","合肥市瑶海区来亨花卉店","个体工商户","存续","22/10/2021","22/10/2021","李海涛",,,"一般项目：花卉种植；礼品花卉销售；日用百货销售；互联网销售（除销售需要许可的商品）（除许可业务外，可自主依法经营法律法规非禁止或限制的项目）","安徽省合肥市瑶海区当涂路与临泉路交口璟泰大厦1301室","2021-10-22至无固定期限","马克数据网","92340102MA8NB2F2X9","340102601426919","MA8NB2F2-X","17756952783",,,"安徽省","合肥市","瑶海区",,"农业"
"244","合肥市瑶海区蔬胜蔬菜经营部","个体工商户","存续","26/5/2022","26/5/2022","邵家胜",,,"一般项目：农副产品销售；蔬菜种植（除许可业务外，可自主依法经营法律法规非禁止或限制的项目）","安徽省合肥市瑶海区大兴镇钟油坊路周谷堆大兴农产品国际物流园副食品交易中心配送41号","2022-05-26至无固定期限","马克数据网","92340102MA8P34378C","340102601566912","MA8P3437-8",,,,"安徽省","合肥市","瑶海区",,"农业"
"245","合肥空上农业种植有限公司","有限责任公司（非自然人投资或控股的法人独资）","存续","15/5/2023","15/5/2023","龚友文","5000000",,"一般项目：谷物种植；蔬菜种植；豆类种植；薯类种植；花卉种植；园艺产品种植；草种植；新鲜蔬菜批发；新鲜蔬菜零售；集贸市场管理服务；互联网销售（除销售需要许可的商品）；谷物销售；豆及薯类销售；棉花种植；水果种植；食用菌种植；农业园艺服务；农作物病虫害防治服务（除许可业务外，可自主依法经营法律法规非禁止或限制的项目）","安徽省合肥市瑶海区明皇路与戚继光路交口文一名门皇马A2栋201室","2023-05-15至无固定期限","马克数据网","91340102MA8QF2H000",,"MA8QF2H0-0",,,,"安徽省","合肥市","瑶海区",,"农业"
"246","合肥风塘柳生态农业科技有限公司","有限责任公司(自然人独资)","存续","14/4/2020","14/4/2020","洪海群","200000",,"农业技术开发、技术咨询、技术交流、技术转让、技术推广、技术服务；花卉、苗木、蔬菜、中药材、水果的种植及销售；家禽、家畜、水产的养殖；草坪、盆景的培育及销售；农家乐观光旅游服务；旅游项目开发与经营管理；旅游商品开发及销售；园林景观设计；鸡蛋批发（含互联网批发）；鱼苗批发；农业园区管理服务；农事体验活动组织、策划；餐饮管理。（依法须经批准的项目，经相关部门批准后方可开展经营活动）","安徽省合肥市瑶海区窑湾路6号1区3栋302号","2020-04-14至无固定期限","马克数据网","91340102MA2UMUC9XC","340102000302902","MA2UMUC9-X","0551-66102118","1653336002@qq.com",,"安徽省","合肥市","瑶海区",,"农业"
"247","合肥市瑶海区梦亦幻花店","个体工商户","存续","10/10/2019","10/10/2019","朱国群",,,"花卉种植；鲜花、绿植销售及租赁服务；婚庆、会务会展、平面设计服务。（依法须经批准的项目，经相关部门批准后方可开展经营活动）","安徽省合肥市瑶海区胜利路与滁州路交口大窑湾6栋205","2019-10-10至无固定期限","马克数据网","92340102MA2U64Q82E","340102601040264","MA2U64Q8-2","15956530089",,,"安徽省","合肥市","瑶海区",,"农业"
"248","安徽枯井园生态农业有限公司","有限责任公司(自然人投资或控股)","吊销，未注销","4/12/2013","6/3/2017","储岳华","1000000",,"瓜果、蔬菜、农作物种植（限分支机构）及销售；农副产品（除专项许可）、茶叶（限食用农产品）批发及零售。","合肥市瑶海区龙岗开发区临泉东路玉兰苑小区15#603室","2013-12-04至2015-12-02","马克数据网","91340100MA2MYY2W3M","340100000878310","MA2MYY2W-3",,,,"安徽省","合肥市","瑶海区",,"农业"
"249","合肥瑶海区楠洋蔬菜经营部","个体工商户","存续","3/12/2018","3/12/2018","汪洋",,,"蔬菜销售；蔬菜种植。（依法须经批准的项目，经相关部门批准后方可开展经营活动）","合肥市瑶海区大兴镇农产品国际物流园内蔬菜区交易中心A1幢11#仓铺","2018-12-03至无固定期限","马克数据网","92340102MA2T9XYR3E","340102600897600","MA2T9XYR-3","13955121502",,,"安徽省","合肥市","瑶海区",,"农业"
"250","合肥市包河区新宇蔬菜种植基地周谷堆销售中心","个人独资企业分支机构","注销","10/10/2020","3/11/2021","刘刚",,,"蔬菜种植、销售；预包装食品批发兼零售。（依法须经批准的项目，经相关部门批准后方可开展经营活动）","安徽省合肥市瑶海区周谷堆大兴农产品国际物流园内蔬菜交易中心A4-9-10-11-12","2020-10-10至无固定期限","马克数据网","91340102MA2WA1BX7Q","340102000359732","MA2WA1BX7","13956942131","1178114588@qq.com",,"安徽省","合肥市","瑶海区",,"农业"
"251","合肥市瑶海区择好农产品销售部","个体工商户","存续","15/11/2022","15/11/2022","张成","50000",,"一般项目：食用农产品批发；食用农产品零售；初级农产品收购；农副产品销售；互联网销售（除销售需要许可的商品）；食品销售（仅销售预包装食品）；食品互联网销售（仅销售预包装食品）；鲜肉零售；鲜肉批发；水产品零售；鲜蛋批发；谷物销售；豆及薯类销售；新鲜蔬菜批发；新鲜水果批发；日用百货销售（除许可业务外，可自主依法经营法律法规非禁止或限制的项目）","安徽省合肥市瑶海区长江东大街紫云府8栋2502","2022-11-15至无固定期限","马克数据网","92340102MA8PPCEX2K","340102601658134","MA8PPCEX-2","18256056602",,,"安徽省","合肥市","瑶海区",,"农业"
"252","合肥市瑶海区四季花开花艺馆","个体工商户","存续","2/9/2022","2/9/2022","邓芮","20000",,"一般项目：花卉绿植租借与代管理；工艺美术品及礼仪用品制造（象牙及其制品除外）；农业园艺服务；花卉种植；礼品花卉销售；日用百货销售；食用农产品批发；新鲜水果零售；新鲜蔬菜零售；城市绿化管理（除许可业务外，可自主依法经营法律法规非禁止或限制的项目）","安徽省合肥市瑶海区长江东路286号春暖花开11栋508","2022-09-02至无固定期限","马克数据网","92340102MA8PECAM7E","340102601621048","MA8PECAM-7","18133677828",,,"安徽省","合肥市","瑶海区",,"农业"
"253","合肥市瑶海区大江淘农业种植部","个体工商户","存续","5/12/2022","5/12/2022","王涛",,,"许可项目：农作物种子经营；食用菌菌种经营（依法须经批准的项目，经相关部门批准后方可开展经营活动，具体经营项目以相关部门批准文件或许可证件为准）一般项目：日用百货销售；农副产品销售；林业产品销售；家用电器销售（除许可业务外，可自主依法经营法律法规非禁止或限制的项目）","安徽省合肥市瑶海区长淮街道凤阳路菜场101号","2022-12-05至无固定期限","马克数据网","92340102MA8PRTG88G","340102601673112","MA8PRTG8-8",,,,"安徽省","合肥市","瑶海区",,"农业"
"254","合肥市瑶海区萄籽田园农副产品经营部","个体工商户","存续","19/9/2022","19/9/2022","吕德杨","300000",,"一般项目：农产品的生产、销售、加工、运输、贮藏及其他相关服务；农副产品销售；食用农产品批发；食用农产品零售；日用百货销售；保健食品（预包装）销售；新鲜水果批发；新鲜水果零售（除许可业务外，可自主依法经营法律法规非禁止或限制的项目）许可项目：食品销售（依法须经批准的项目，经相关部门批准后方可开展经营活动，具体经营项目以相关部门批准文件或许可证件为准）","安徽省合肥市瑶海区当涂路153号（唐桥水果批发市场）","2022-09-19至无固定期限","马克数据网","92340102MA8PG9RU37","340102601629430","MA8PG9RU-3",,,,"安徽省","合肥市","瑶海区",,"农业"
"255","合肥市瑶海区邱秀云蔬菜种植经营部","个体工商户","存续","8/6/2022","8/6/2022","邱秀云","200000",,"一般项目：蔬菜种植（除许可业务外，可自主依法经营法律法规非禁止或限制的项目）","安徽省合肥市瑶海区大众路伏龙村张洼组路西边1号","2022-06-08至无固定期限","马克数据网","92340102MA8P4EF50M","340102601572927","MA8P4EF5-0",,,,"安徽省","合肥市","瑶海区",,"农业"
"256","合肥市瑶海区双阔种植家庭农场","个体工商户","存续","21/12/2020","18/4/2023","周双平",,,"一般项目：花卉种植；谷物种植；水果种植；蔬菜种植；农作物栽培服务（除许可业务外，可自主依法经营法律法规非禁止或限制的项目）","合肥市瑶海区砂轮新村6栋101","2020-12-21至无固定期限","马克数据网","92340102MA2WJC6F78","340102601262144","MA2WJC6F-7","18019981608",,,"安徽省","合肥市","瑶海区",,"农业"
"257","合肥市粮贸经济发展公司","集体所有制","吊销，未注销","1/12/1998","1/12/1998","赵世文",,,"百货、纺织品、粮油、五金、建筑材料、钢材、水泥、汽车配件、包装材料销售，打字、复印，家用电器、电动机修理。","安徽省合肥市胜利路80号","1998-12-01至无固定期限","马克数据网",,"14900928-1",,,,,"安徽省","合肥市","瑶海区",,"农业"
"258","合肥坝子叶林农科技有限公司","有限责任公司(自然人投资或控股)","吊销，未注销","2/9/2013","6/3/2017","叶志明","1000000",,"苗木、花卉种植、批发、零售；蔬菜、农产品（除专项许可）种植、批发、零售；种植技术推广、咨询。","合肥市瑶海区长江东路与龙岗路交口琥珀名城A区23幢202室","2013-09-02至2033-09-02","马克数据网","91340100MA2MY9HH87","340100000835384","MA2MY9HH-8",,,,"安徽省","合肥市","瑶海区",,"农业"
"259","合肥市瑶海区凯香花店","个体工商户","存续","13/8/2019","13/8/2019","杨修柱",,,"花卉种植（依法须经批准的项目，经相关部门批准后方可开展经营活动）","合肥市瑶海区和平路137号","2019-08-13至无固定期限","马克数据网","92340102MA2U0RPP5T","340102601010991","MA2U0RPP-5","13053172195",,,"安徽省","合肥市","瑶海区",,"农业"
"260","李俊茹","个体工商户","注销","3/2/2021","3/2/2023","李俊茹",,,"鲜花、干花销售（依法须经批准的项目，经相关部门批准后方可开展经营活动）","合肥市瑶海区长江东路933号兴苑小区4栋101室","2021-02-03至2023-02-03","马克数据网","92340102MA2WNK4PXT","340102601283480","MA2WNK4P-X",,,,"安徽省","合肥市","瑶海区",,"农业"
"261","合肥市瑶海区乔君花卉经营部","个体工商户","注销","5/1/2021","1/12/2021","乔君",,,"花卉零售；花卉租摆。（依法须经批准的项目，经相关部门批准后方可开展经营活动）","安徽省合肥市瑶海区明光路裕丰花市D区13号",,"马克数据网","92340102MA2WKMXX98","340102601269347","MA2WKMXX9",,,,"安徽省","合肥市","瑶海区",,"农业"
"262","合肥市瑶海区花迎你来鲜花店","个体工商户","存续","28/2/2023","28/2/2023","吴菊英",,,"一般项目：礼品花卉销售；花卉种植（除许可业务外，可自主依法经营法律法规非禁止或限制的项目）","安徽省合肥市瑶海区王岗路襄河家园13栋105室","2023-02-28至无固定期限","马克数据网","92340102MA8Q3NM63N","340102601734979","MA8Q3NM6-3",,,,"安徽省","合肥市","瑶海区",,"农业"
"263","合肥兴璐佳农产品批发有限公司","有限责任公司(自然人投资或控股)","存续","18/9/2018","23/10/2020","汪璐","3000000",,"蔬菜、农副产品销售；农产品种植；农业领域内的技术研发。（依法须经批准的项目，经相关部门批准后方可开展经营活动）","安徽省合肥市瑶海区周谷堆大兴农产品物流园内蔬菜中心A4栋19号","2018-09-18至2048-09-17","马克数据网","91340102MA2T33T578","340102000127391","MA2T33T5-7","13956958778;18133604289","2438103794@qq.com",,"安徽省","合肥市","瑶海区",,"农业"
"264","合肥市农兴农业科技有限公司","有限责任公司(自然人投资或控股)","存续","18/3/2011","14/9/2018","杨帮雷","5000000",,"食用菌研发、种植及销售。","安徽省合肥市新站区磨店乡群治村卫高村民组","2011-03-18至2031-03-17","马克数据网","91340100571752898H","340108000093962","57175289-8","13966689137;15856388198","15856388198@139.com|1208536373@qq.com|1059093900@qq.com",,"安徽省","合肥市","瑶海区",,"农业"
"265","合肥市瑶海区彭守春蔬菜种植场","个体工商户","存续","18/10/2022","18/10/2022","彭守春",,,"一般项目：蔬菜种植；蔬菜种植（除中国稀有和特有的珍贵优良品种）；新鲜蔬菜零售；水产品零售（除许可业务外，可自主依法经营法律法规非禁止或限制的项目）许可项目：水产养殖（依法须经批准的项目，经相关部门批准后方可开展经营活动，具体经营项目以相关部门批准文件或许可证件为准）","安徽省合肥市瑶海区裕溪路大兴镇伏龙村张洼村民组69号","2022-10-18至无固定期限","马克数据网","92340102MA8PKPAPXT","340102601646075","MA8PKPAP-X",,,,"安徽省","合肥市","瑶海区",,"农业"
"266","合肥市瑶海区鲜达浪农副产品经营场","个体工商户","存续","22/5/2023","22/5/2023","牛梦雪",,,"许可项目：食品销售（依法须经批准的项目，经相关部门批准后方可开展经营活动，具体经营项目以相关部门批准文件或许可证件为准）一般项目：互联网销售（除销售需要许可的商品）；农副产品销售；农产品的生产、销售、加工、运输、贮藏及其他相关服务；牲畜销售（除许可业务外，可自主依法经营法律法规非禁止或限制的项目）","安徽省合肥市瑶海区裕存堂21栋2701室","2023-05-22至无固定期限","马克数据网","92340102MA8QG41P4C","340102601831385","MA8QG41P-4",,,,"安徽省","合肥市","瑶海区",,"农业"
"267","合肥瑶海区文涛鲜花店","个体工商户","注销","23/12/2020","24/8/2021","朱文涛",,,"鲜花销售。（依法须经批准的项目，经相关部门批准后方可开展经营活动）","合肥市瑶海区当涂路与临泉路交口苹果公寓2栋503室","2020-12-23至无固定期限","马克数据网","92340102MA2WJK5F2M","340102601263379","MA2WJK5F-2","15309668711",,,"安徽省","合肥市","瑶海区",,"农业"
"268","合肥市瑶海区九月啊花店","个体工商户","存续","4/11/2019","15/6/2022","杨晓涵",,,"一般项目：日用百货销售；礼品花卉销售；组织文化艺术交流活动；会议及展览服务；婚庆礼仪服务；信息技术咨询服务；美甲服务；食品销售（仅销售预包装食品）；农副产品销售（除许可业务外，可自主依法经营法律法规非禁止或限制的项目）","合肥市瑶海区胜利路以西临泉路以南临泉路商住楼18号门面","2019-11-04至无固定期限","马克数据网","92340102MA2U91H323","340102601055334","MA2U91H3-2","13615514997",,,"安徽省","合肥市","瑶海区",,"农业"
"269","董学琴","个体工商户","吊销，未注销","3/3/2011","26/11/2012","董学琴",,,"花卉、盆景销售及婚庆服务。","安徽省合肥市龙岗开发区长江东路171号",,"马克数据网",,"340102600167295",,,,,"安徽省","合肥市","瑶海区",,"农业"
"270","合肥市瑶海区荸荠农副产品销售经营部","个体工商户","存续","12/5/2023","12/5/2023","赵志鹏",,,"一般项目：农副产品销售；新鲜蔬菜批发；新鲜蔬菜零售；新鲜水果批发；新鲜水果零售；食用农产品初加工（除许可业务外，可自主依法经营法律法规非禁止或限制的项目）许可项目：食品销售（依法须经批准的项目，经相关部门批准后方可开展经营活动，具体经营项目以相关部门批准文件或许可证件为准）","安徽省合肥市瑶海区钟油坊路合肥周谷堆大兴农产品国际物流园内蔬菜交易中心马蹄区19号","2023-05-12至无固定期限","马克数据网","92340102MA8QEUE29N","340102601822954","MA8QEUE2-9",,,,"安徽省","合肥市","瑶海区",,"农业"
"271","合肥市瑶海区订花派花卉店","个体工商户","存续","19/4/2022","19/4/2022","李亮",,,"一般项目：礼品花卉销售；互联网销售（除销售需要许可的商品）（除许可业务外，可自主依法经营法律法规非禁止或限制的项目）","安徽省合肥市瑶海区姑溪路春晖里3幢303室","2022-04-19至无固定期限","马克数据网","92340102MA8NY7N2X8","340102601542834","MA8NY7N2-X","13965024313",,,"安徽省","合肥市","瑶海区",,"农业"
"272","合肥市瑶海区花漾晴溪鲜鲜花工作室","个体工商户","存续","4/5/2023","4/5/2023","吴杨亲",,,"一般项目：礼品花卉销售；工艺美术品及收藏品零售（象牙及其制品除外）；新鲜水果零售；食品销售（仅销售预包装食品）；互联网销售（除销售需要许可的商品）；婚庆礼仪服务（除许可业务外，可自主依法经营法律法规非禁止或限制的项目）","安徽省合肥市瑶海区恒大中央广场43栋3813室","2023-05-04至无固定期限","马克数据网","92340102MA8QDGWK7A","340102601813218","MA8QDGWK-7",,,,"安徽省","合肥市","瑶海区",,"农业"
"273","合肥市瑶海区馨香花卉店","个体工商户","存续","12/5/2020","12/5/2020","王进",,,"其他日用品零售；鲜花礼品批发（含互联网批发）；礼品鲜花零售(含互联网零售)；盆栽花批发（含互联网批发）；花盆栽培植物零售(含互联网零售)（依法须经批准的项目，经相关部门批准后方可开展经营活动）","合肥市瑶海区裕丰花市一期交易区摊位29、30、31、32号","2020-05-12至无固定期限","马克数据网","92340102MA2UR3Q338","340102601132188","MA2UR3Q3-3","13965053953",,,"安徽省","合肥市","瑶海区",,"农业"
