"id","company_name","company_type","business_status","establishment_date","approval_date","legal_representative","registered_capital","company_size","business_scope","registered_address","business_term","source","taxpayer_identification_number","business_registration_number","organization_code","contact_phone","email","taxpayer_qualification","province","city","district","website_link","industry"
"472","安徽兮荷商贸有限公司","有限责任公司(自然人投资或控股)","存续","28/10/2020","28/10/2020","张卫国","10000000",,"水果、蔬菜、粮油销售、配送（除快递）；餐饮管理；五金、服装销售；农产品种植、销售。（依法须经批准的项目，经相关部门批准后方可开展经营活动）","安徽省合肥市瑶海区长江东路474号聚业苑4幢206室","2020-10-28至无固定期限","马克数据网","91340102MA2WCA301B","340102000366215","MA2WCA30-1","13905608030","327452014@qq.com",,"安徽省","合肥市","瑶海区",,"农业"
"473","合肥芙洛薇花卉有限公司","有限责任公司(自然人独资)","存续","16/6/2022","16/6/2022","张川云","100000",,"一般项目：礼品花卉销售；花卉绿植租借与代管理；婚庆礼仪服务；日用百货销售；橡胶制品销售；会议及展览服务（除许可业务外，可自主依法经营法律法规非禁止或限制的项目）","安徽省合肥市瑶海区长江东路180号恒通批发市场015号","2022-06-16至无固定期限","马克数据网","91340102MA8P5EAE86","340102000605882","MA8P5EAE-8","15240010109","15240010109@qq.com",,"安徽省","合肥市","瑶海区",,"农业"
"474","合肥市四季青生态农业专业合作社","农民专业合作社","存续","29/11/2011","29/11/2011","刘智华","2000000","小于50人","以本社成员为主要服务对象，提供农业生产资料购买，农产品（除专项审批）销售、贮藏，苗木种植、销售以及与农业生产经营有关的技术、信息服务。","安徽省合肥市新站区磨店乡磨店集","2011-11-29至无固定期限","马克数据网","933401005872038771","340108NA001008X","58720387-7","0551-4248649;13956061339","1127322523@qq.com|125862362741@qq.com|1235685954@qq.com|13866198196@qq.com|13956061339@139.com|794537972@qq.com",,"安徽省","合肥市","瑶海区",,"农业"
"475","韩云菊","个体工商户","存续","13/5/2010","13/5/2010","韩云菊",,,"鲜花销售","安徽省合肥市瑶海区龙岗二路车底站3号门面","2010-05-13至无固定期限","马克数据网","92340102MA2PB65G2M","340102600125093","MA2PB65G-2","15856383490",,,"安徽省","合肥市","瑶海区",,"农业"
"476","合肥市瑶海区大江韬韬水果种植部","个体工商户","存续","5/12/2022","5/12/2022","王涛","30000",,"一般项目：新鲜水果零售；林产品采集；食用农产品零售；日用百货销售；食用农产品批发；蔬菜种植；新鲜蔬菜零售；新鲜蔬菜批发；新鲜水果批发（除许可业务外，可自主依法经营法律法规非禁止或限制的项目）","安徽省合肥市瑶海区长淮街道凤阳路菜场103号","2022-12-05至无固定期限","马克数据网","92340102MA8PRTMY9N","340102601673170","MA8PRTMY-9",,,,"安徽省","合肥市","瑶海区",,"农业"
"477","合肥谦辉水果销售有限公司","有限责任公司(自然人投资或控股)","存续","14/4/2023","14/4/2023","王志辉","1000000",,"一般项目：新鲜水果批发；新鲜水果零售；食用农产品批发；食用农产品零售；外卖递送服务；互联网销售（除销售需要许可的商品）；食品销售（仅销售预包装食品）；食品互联网销售（仅销售预包装食品）；农产品的生产、销售、加工、运输、贮藏及其他相关服务；包装服务；日用百货销售；水产品批发；水产品零售；玩具销售（除许可业务外，可自主依法经营法律法规非禁止或限制的项目）","安徽省合肥市瑶海区钟油坊路与月亮湾路交口百大周谷堆水果市场东临12A02号","2023-04-14至无固定期限","马克数据网","91340102MA8QB67308",,"MA8QB673-0",,,,"安徽省","合肥市","瑶海区",,"农业"
"478","安徽魔童品牌运营管理有限公司","有限责任公司(自然人投资或控股)","存续","29/7/2016","18/11/2021","吴燕","5000000",,"一般项目：品牌管理；服装服饰批发；服装服饰零售；服装制造；母婴用品销售；玩具制造；鞋帽批发；玩具销售；鞋帽零售；箱包销售；文具用品批发；文具用品零售；日用百货销售；体育用品及器材制造；体育用品及器材批发（除许可业务外，可自主依法经营法律法规非禁止或限制的项目）","安徽省合肥市瑶海区胜利北路88号五洲商城5034号一楼门面","2016-07-29至无固定期限","马克数据网","91340121MA2MYD7C47","340121000094220","MA2MYD7C-4","18715518903","47945947@qq.com",,"安徽省","合肥市","瑶海区",,"农业"
"479","庞士雨","个体工商户","注销","21/11/2019","29/6/2020","庞士雨",,,"鲜花销售。（依法须经批准的项目，经相关部门批准后方可开展经营活动）","安徽省合肥市瑶海区铜陵路141号",,"马克数据网","92340102MA2UB3NP7H","340102601067176","MA2UB3NP7",,,,"安徽省","合肥市","瑶海区",,"农业"
"480","安徽景园农产品有限公司","有限责任公司(自然人投资或控股)","存续","9/3/2020","9/3/2020","章书照","5000000",,"蔬菜种植；农产品销售；果品、蔬菜批发。（依法须经批准的项目，经相关部门批准后方可开展经营活动）","安徽省合肥市瑶海区合肥周谷堆大兴农产品国际物流园蔬菜交易中心A1-15＃、16＃","2020-03-09至无固定期限","马克数据网","91340102MA2UHM4N4L","340102000288637","MA2UHM4N-4","13865906903","1137395022@qq.com",,"安徽省","合肥市","瑶海区",,"农业"
"481","合肥木草堂花卉有限公司","有限责任公司(自然人投资或控股)","吊销，未注销","23/4/2007","1/3/2019","王虎","1000000",,"花木租赁、销售、种植；园艺资材销售；园林绿化工程。","安徽省合肥市新站区站前路城市驿站金方城3幢215室","2007-04-23至2027-04-12","马克数据网","91340100MA2MXTEB96","340108000010256","MA2MXTEB-9",,,,"安徽省","合肥市","瑶海区",,"农业"
"482","合肥市新站区瑞强苗木种植中心","个体工商户","存续","13/12/2017","13/12/2017","王瑞强","80",,"苗木、蔬菜、瓜果研发、种植、销售。（依法须经批准的项目，经相关部门批准后方可开展经营活动）","合肥市新站区三十头社区三房岗社居委小洼组","2017-12-13至无固定期限","马克数据网","92340100MA2RBKTY2H","340108600301070","MA2RBKTY-2","13866148037;13956665555",,,"安徽省","合肥市","瑶海区",,"农业"
"483","合肥向日葵农业发展有限公司","有限责任公司(自然人投资或控股)","存续","10/4/2015","21/3/2023","龚雪影","5000000",,"一般项目：谷物种植；技术服务、技术开发、技术咨询、技术交流、技术转让、技术推广；初级农产品收购；园林绿化工程施工；花卉种植；塑料制品销售；礼品花卉销售；花卉绿植租借与代管理；城市绿化管理；五金产品批发；园艺产品销售；制冷、空调设备销售；化肥销售；日用木制品销售；家政服务；工艺美术品及礼仪用品制造（象牙及其制品除外）；日用百货销售；办公用品销售；金属结构销售；文化用品设备出租；金属制品销售；建筑材料销售；涂料销售（不含危险化学品）；玩具、动漫及游艺用品销售；劳务服务（不含劳务派遣）；文具用品零售；家具制造；家具销售；专业设计服务；日用木制品制造；金属结构制造；照明器具销售；针纺织品及原料销售；物联网应用服务；软件开发；建筑装饰材料销售；建筑用木料及木材组件加工；专业保洁、清洗、消毒服务；消防器材销售；教学专用仪器销售；农业机械销售；工艺美术品及礼仪用品销售（象牙及其制品除外）；交通及公共管理用标牌销售；交通及公共管理用金属标牌制造；农产品的生产、销售、加工、运输、贮藏及其他相关服务；食用农产品零售；配电开关控制设备销售；肥料销售；广告制作（除许可业务外，可自主依法经营法律法规非禁止或限制的项目）许可项目：建设工程设计；住宅室内装饰装修；建设工程施工；林木种子生产经营（依法须经批准的项目，经相关部门批准后方可开展经营活动，具体经营项目以相关部门批准文件或许可证件为准）","合肥市瑶海区 长江中路与龙岗路交口琥珀名城沁园42幢606室","2015-04-10至2045-04-09","马克数据网","913401003367252400","340100001227257","33672524-0","18756978369","18756978369@qq.com|2457344880@qq.com|3298446995@qq.com|362225120@qq.com",,"安徽省","合肥市","瑶海区",,"农业"
"484","合肥市瑶海区中垒农副产品经营部","个体工商户","存续","1/11/2021","1/11/2021","朱祖忠",,,"许可项目：家禽饲养（依法须经批准的项目，经相关部门批准后方可开展经营活动）一般项目：蔬菜种植；花卉种植；水产品零售（除许可业务外，可自主依法经营法律法规非禁止或限制的项目）","合肥市瑶海区龙岗路店岗新村9号楼108号","2021-11-01至无固定期限","马克数据网","92340102MA8NC4PY6J","340102601432020","MA8NC4PY-6","13965055653",,,"安徽省","合肥市","瑶海区",,"农业"
"485","合肥市瑶海区花间享茶鲜花店","个体工商户","存续","23/3/2020","23/3/2020","丁冬静",,,"其他未列明零售业；花卉零售；花卉租摆（依法须经批准的项目，经相关部门批准后方可开展经营活动）","合肥市瑶海区龙岗路文一名城绿洲小区商铺S12-107号","2020-03-23至无固定期限","马克数据网","92340102MA2UK5TK9N","340102601101148","MA2UK5TK-9","18256060909",,,"安徽省","合肥市","瑶海区",,"农业"
"486","中蔬信农农业投资有限公司","其他有限责任公司","存续","7/8/2017","25/2/2021","吴月高","100000000",,"农业投资、开发；农产品批发市场投资、建设、运营管理；物流、仓储、冷冻服务（除危险品）；物业管理；房地产开发；农场体验；有机食品销售；旅游开发。（依法须经批准的项目，经相关部门批准后方可开展经营活动）","合肥市瑶海区滁州路95号1幢408室","2017-08-07至无固定期限","马克数据网","91340100MA2NWEKF4B","340100002036821","MA2NWEKF-4","13339109133;13359019133;13965013905","2465030079@qq.com|1716014454@qq.com|631254884@qq.com",,"安徽省","合肥市","瑶海区",,"农业"
"487","合肥市瑶海区花城花鲜花店","个体工商户","存续","29/3/2023","29/3/2023","沈传亮",,,"一般项目：礼品花卉销售；互联网销售（除销售需要许可的商品）（除许可业务外，可自主依法经营法律法规非禁止或限制的项目）","安徽省合肥市瑶海区长江东路504号","2023-03-29至无固定期限","马克数据网","92340102MA8Q8QTE93","340102601774865","MA8Q8QTE-9",,,,"安徽省","合肥市","瑶海区",,"农业"
"488","合肥市瑶海区薪火农产品经营工作室","个体工商户","存续","17/5/2023","17/5/2023","李志豪",,,"一般项目：农产品的生产、销售、加工、运输、贮藏及其他相关服务（除许可业务外，可自主依法经营法律法规非禁止或限制的项目）","安徽省合肥市瑶海区安徽广播影视职业技术学院传媒艺术楼2楼李志强大师工作室","2023-05-17至无固定期限","马克数据网","92340102MA8QFGD62P","340102601827900","MA8QFGD6-2",,,,"安徽省","合肥市","瑶海区",,"农业"
"489","合肥市瑶海区荃蕙花卉店","个体工商户","存续","11/6/2021","11/6/2021","徐慧敏",,,"一般项目：礼品花卉销售（除许可业务外，可自主依法经营法律法规非禁止或限制的项目）（依法须经批准的项目，经相关部门批准后方可开展经营活动）","合肥市瑶海区临泉路与王岗路交口恒大城37-38幢37-301","2021-06-11至无固定期限","马克数据网","92340102MA8LLRC13D","340102601353485","MA8LLRC1-3",,,,"安徽省","合肥市","瑶海区",,"农业"
"490","合肥市瑶海区语寻花店","个体工商户","注销","10/9/2019","4/6/2020","赵生芹",,,"花卉种植；鲜花、绿植、盆景销售；会展服务；婚庆服务。（依法须经批准的项目，经相关部门批准后方可开展经营活动）","安徽省合肥市瑶海区龙岗开发区临泉路南侧阳光棕榈园4幢041室",,"马克数据网","92340102MA2U3HP18T","340102601025675","MA2U3HP18",,,,"安徽省","合肥市","瑶海区",,"农业"
"491","安徽清海农产品商贸有限公司","有限责任公司(自然人独资)","存续","21/3/2019","21/3/2019","张国清","5000000",,"蔬菜、农副产品销售；农产品种植；农业领域内的技术研发。（依法须经批准的项目，经相关部门批准后方可开展经营活动）","安徽省合肥市瑶海区周谷堆农产品国际物流园内A1-9号","2019-03-21至2049-03-20","马克数据网","91340102MA2TJH8164","340102000174999","MA2TJH81-6","13956958778;18133604289;18133604689","2438103794@qq.com",,"安徽省","合肥市","瑶海区",,"农业"
"492","合肥市瑶海区孙氏花卉店","个体工商户","存续","12/5/2022","12/5/2022","孙芳琴",,,"一般项目：礼品花卉销售（除许可业务外，可自主依法经营法律法规非禁止或限制的项目）","安徽省合肥市瑶海区和平路街道裕丰花市交易区17-20号","2022-05-12至无固定期限","马克数据网","92340102MA8P1AA86T","340102601557203","MA8P1AA8-6",,,,"安徽省","合肥市","瑶海区",,"农业"
"493","合肥瑶海区周馨雨花店","个体工商户","注销","11/1/2019","23/5/2019","周馨雨",,,"鲜花销售。（依法须经批准的项目，经相关部门批准后方可开展经营活动）","合肥市瑶海区大通路121号","2019-01-11至无固定期限","马克数据网","92340102MA2TDRBU73","340102600914093","MA2TDRBU-7","18856963834",,,"安徽省","合肥市","瑶海区",,"农业"
"494","合肥贝斯邦农业技术有限公司","有限责任公司(自然人投资或控股)","注销","9/3/2016","11/1/2022","李庆刚","2000000",,"蔬菜、花卉无土种植、技术开发、技术咨询及技术转让；电子产品、机械设备、化肥、种苗的研发、生产、销售及售后服务。（依法须经批准的项目，经相关部门批准后方可开展经营活动）","合肥市新站区三十头社区四十头村","2016-03-09至无固定期限","马克数据网","91340100MA2MTN0G22","340108000143848","MA2MTN0G-2","0551-66336232;13865930232","13865930232@163.com",,"安徽省","合肥市","瑶海区",,"农业"
"495","安徽国芽蔬菜科技有限公司周谷堆店","有限责任公司分公司(自然人投资或控股)","存续","4/1/2022","4/1/2022","方勇",,,"一般项目：新鲜蔬菜批发；蔬菜种植；农副产品销售（除许可业务外，可自主依法经营法律法规非禁止或限制的项目）","安徽省合肥市瑶海区大兴镇和平路周谷堆商业街1F-07","2022-01-04至无固定期限","马克数据网","91340102MA8NKJL4XC","340102000550137","MA8NKJL4-X",,,,"安徽省","合肥市","瑶海区",,"农业"
"496","合肥市瑶海区花期花间鲜花店","个体工商户","存续","9/5/2022","9/5/2022","王存霞",,,"一般项目：礼品花卉销售；互联网销售（除销售需要许可的商品）（除许可业务外，可自主依法经营法律法规非禁止或限制的项目）","安徽省合肥市瑶海区临泉路与定远路交口汪塘花园3幢204室","2022-05-09至无固定期限","马克数据网","92340102MA8P0YC973","340102601555507","MA8P0YC9-7",,,,"安徽省","合肥市","瑶海区",,"农业"
"497","合肥扎默农业发展有限公司","有限责任公司(非自然人投资或控股的法人独资)","存续","6/3/2023","6/3/2023","许才强","1000000",,"一般项目：农业专业及辅助性活动；蔬菜种植；谷物种植；薯类种植；豆类种植；花卉种植；食用菌种植；水果种植；茶叶种植；农业园艺服务；智能农业管理；机械设备销售；食用农产品零售；互联网销售（除销售需要许可的商品）；劳动保护用品销售（除许可业务外，可自主依法经营法律法规非禁止或限制的项目）","安徽省合肥市瑶海区王岗路与丰乐亭路交口名门皇马A2栋201室","2023-03-06至无固定期限","马克数据网","91340102MA8Q4KX79W",,"MA8Q4KX7-9",,,,"安徽省","合肥市","瑶海区",,"农业"
"498","合肥市升胜农业有限公司","有限责任公司(自然人投资或控股)","存续","22/2/2023","22/2/2023","陈国栋","500000",,"一般项目：蔬菜种植；水果种植；新鲜水果批发；新鲜水果零售；新鲜蔬菜批发；新鲜蔬菜零售；蔬菜种植（除中国稀有和特有的珍贵优良品种）；农产品的生产、销售、加工、运输、贮藏及其他相关服务；农作物栽培服务；食用农产品零售；食用农产品批发（除许可业务外，可自主依法经营法律法规非禁止或限制的项目）","安徽省合肥市瑶海区和平路百大新周谷堆菌菇区A10-17号","2023-02-22至无固定期限","马克数据网","91340102MA8Q2HTK0E",,"MA8Q2HTK-0",,,,"安徽省","合肥市","瑶海区",,"农业"
"499","合肥市瑶海区姜氏菜业经营部","个体工商户","存续","1/6/2016","3/7/2019","姜多好","140000",,"批发零售蔬菜；蔬菜种植。（依法须经批准的项目，经相关部门批准后方可开展经营活动）","合肥周谷堆大兴农产品国际物流园内蔬菜交易中心A3栋14号","2016-06-01至无固定期限","马克数据网","92340102MA2PARM1X6","340102600602326","MA2PARM1-X","13335513213;13866737418;18133604289",,,"安徽省","合肥市","瑶海区",,"农业"
"500","合肥市瑶海区惜颜花艺坊","个体工商户","存续","6/5/2022","6/5/2022","方玉琴",,,"一般项目：礼品花卉销售；花卉绿植租借与代管理；肥料销售（除许可业务外，可自主依法经营法律法规非禁止或限制的项目）","安徽省合肥市瑶海区凤阳东路与和县路交叉口往东200米长江180艺术街区2号仓铺","2022-05-06至无固定期限","马克数据网","92340102MA8P0MN00U","340102601553450","MA8P0MN0-0","17775336199",,,"安徽省","合肥市","瑶海区",,"农业"
"501","合肥瑶海区冯艳鲜花店","个体工商户","注销","20/11/2018","23/5/2019","冯艳",,,"鲜花销售、花盆销售。（依法须经批准的项目，经相关部门批准后方可开展经营活动）","合肥市瑶海区长江东路30号","2018-11-20至无固定期限","马克数据网","92340102MA2T8ME691","340102600891412","MA2T8ME6-9","18256972239",,,"安徽省","合肥市","瑶海区",,"农业"
"502","安徽耀赢生态农业有限公司","有限责任公司（自然人投资或控股）","注销","22/3/2022","29/5/2023","陈伟","5000000",,"一般项目：谷物种植；豆类种植；油料种植；薯类种植；棉花种植；蔬菜种植；树木种植经营；水果种植；花卉种植；灌溉服务；农作物收割服务；农业生产托管服务；谷物销售；食用农产品批发；粮食收购（除许可业务外，可自主依法经营法律法规非禁止或限制的项目）许可项目：水产养殖（依法须经批准的项目，经相关部门批准后方可开展经营活动，具体经营项目以相关部门批准文件或许可证件为准）","安徽省合肥市瑶海区临泉路江晨园小区B5栋206室","2022-03-22至无固定期限","马克数据网","91340102MA8NUFH055","340102000574788","MA8NUFH0-5","15155929817","15155929817@qq.com",,"安徽省","合肥市","瑶海区",,"农业"
"503","合肥市瑶海区水涧蔬菜种植经营部","个体工商户","存续","14/3/2023","14/3/2023","高俊",,,"一般项目：蔬菜种植；水果种植；食用菌种植；花卉种植；园艺产品种植；豆类种植；谷物种植；棉花种植；坚果种植；茶叶种植；水生植物种植；农副产品销售（除许可业务外，可自主依法经营法律法规非禁止或限制的项目）","安徽省合肥市瑶海区裕溪路大兴镇付龙村张洼村民组196号","2023-03-14至无固定期限","马克数据网","92340102MA8Q64RU6H","340102601753442","MA8Q64RU-6",,,,"安徽省","合肥市","瑶海区",,"农业"
"504","合肥市瑶海区意民农产品销售部","个体工商户","存续","24/6/2022","24/6/2022","张厚英",,,"一般项目：食用农产品批发；食用农产品零售；初级农产品收购；农副产品销售；互联网销售（除销售需要许可的商品）；食品销售（仅销售预包装食品）；食品互联网销售（仅销售预包装食品）；鲜肉零售；鲜肉批发；水产品零售；鲜蛋批发；谷物销售；豆及薯类销售；新鲜蔬菜批发；新鲜水果批发；日用百货销售（除许可业务外，可自主依法经营法律法规非禁止或限制的项目）","安徽省合肥市瑶海区当涂路森海豪庭20幢905室","2022-06-24至无固定期限","马克数据网","92340102MA8P6EWGX4","340102601582676","MA8P6EWG-X","18956001263",,,"安徽省","合肥市","瑶海区",,"农业"
"505","合肥市瑶海区马文佩花卉店","个体工商户","存续","5/6/2020","5/6/2020","马文佩",,,"其他日用品零售；花卉种植；花卉作物批发（含互联网批发）；花卉零售(含互联网零售)；花卉租摆；礼品鲜花零售(含互联网零售)；鲜花礼品批发（含互联网批发）；园林绿化工程施工；园林陶瓷制品批发（含互联网批发）（依法须经批准的项目，经相关部门批准后方可开展经营活动）","合肥市瑶海区裕丰花市兰亭交易区9号","2020-06-05至无固定期限","马克数据网","92340102MA2UW21L6G","340102601149353","MA2UW21L-6","13814182064",,,"安徽省","合肥市","瑶海区",,"农业"
"506","合肥市瑶海区米妞花店","个体工商户","存续","23/10/2019","23/10/2019","陈兰英",,,"花卉种植；鲜花、绿植销售。（依法须经批准的项目，经相关部门批准后方可开展经营活动）","安徽省合肥市瑶海区张洼路96号105室","2019-10-23至无固定期限","马克数据网","92340102MA2U7NDU7W","340102601048904","MA2U7NDU-7","13615696812",,,"安徽省","合肥市","瑶海区",,"农业"
"507","合肥市瑶海区大江韬农产品经营部","个体工商户","存续","25/11/2022","25/11/2022","王涛","30000",,"一般项目：树木种植经营；畜牧渔业饲料销售；棉、麻销售；水产品批发；农副产品销售；林业产品销售；豆及薯类销售（除许可业务外，可自主依法经营法律法规非禁止或限制的项目）","安徽省合肥市瑶海区长淮街道凤阳路菜场86号","2022-11-25至无固定期限","马克数据网","92340102MA8PQT3718","340102601665776","MA8PQT37-1","15755173644",,,"安徽省","合肥市","瑶海区",,"农业"
"508","合肥瑶海区柏华花木店","个体工商户","存续","26/12/2011","22/9/2016","王汝波","50000",,"花卉 销售及租赁服务 绿化服务（依法须经批准的项目，经相关部门批准后方可开展经营活动）","安徽省合肥市裕溪路1249号1栋104室","2011-12-26至无固定期限","马克数据网","92340102MA2NL74949","340102600230371","MA2NL749-4","13956037864",,,"安徽省","合肥市","瑶海区",,"农业"
"509","张勇","个体工商户","存续","4/2/2013","4/2/2013","张勇",,,"卷烟 百货/零售（在许可证有效期内经营）","合肥市铜陵路20号","2013-02-04至无固定期限","马克数据网","92340102MA2PBC4520","340102600316483","MA2PBC45-2","0551-64451320",,,"安徽省","合肥市","瑶海区",,"农业"
"510","王宏甫","个体工商户","吊销，未注销","5/12/2007","26/11/2012","王宏甫",,,"蘑菇种植、菌种培育","安徽省合肥市瑶海区大兴镇伏龙村彭西一组",,"马克数据网",,"340102600019348?",,,,,"安徽省","合肥市","瑶海区",,"农业"
"511","合肥市惠志果蔬种植专业合作社","农民专业合作社","存续","30/6/2014","9/9/2014","唐进步","5000000",,"果蔬种植、销售；农业技术推广、咨询及农业项目研发。","合肥市瑶海区蘩昌路1号银马公寓5幢701","2014-06-30至无固定期限","马克数据网","93340100MA2N1FLYXX","340104NA001017X","MA2N1FLY-X","13855725288;13865965515;18755725288","123456@qq.com|543573099@qq.com|1234567890@qq.com|123290801@qq.com",,"安徽省","合肥市","瑶海区",,"农业"
"512","合肥市瑶海区花殿一花店","个体工商户","存续","22/6/2020","22/6/2020","谢玉莲",,,"百货零售；花卉租摆；花卉零售(含互联网零售)；花画工艺品零售(含互联网零售)；花盆栽培植物零售(含互联网零售)；鲜花批发（含互联网批发）；婚庆礼仪服务；经济与商务咨询服务（依法须经批准的项目，经相关部门批准后方可开展经营活动）","合肥市瑶海区智慧公馆东门商铺6号楼","2020-06-22至无固定期限","马克数据网","92340102MA2UXNHT6R","340102601159686","MA2UXNHT-6","18815517879",,,"安徽省","合肥市","瑶海区",,"农业"
