"company_name","business_status","legal_representative","registered_capital","paid_in_capital","establishment_date","approval_date","business_term","province","city","district","phone","additional_phones","email","additional_emails","unified_social_credit_code","taxpayer_identification_number","business_registration_number","organization_code","insured_personnel_count","company_type","industry","former_name","registered_address","latest_annual_report_address","website","business_scope","match_status"
"合肥国鑫建筑工程有限公司","开业","张正好","8000000","8000000","27/6/2011 00:00:00","30/4/2024 00:00:00","-","安徽省","合肥市","肥西县","0551-68850035","17705654816,13856929388,13801758931,15255883099,0551-68835971","929718608@qq.com","970798193@qq.com,474351847@qq.com,2497005673@qq.com,249700567@qq.com","913401235770895130","913401235770895130","340123000063254","57708951-3","16","有限责任公司(自然人投资或控股)","房屋建筑业","-","安徽省合肥市肥西县上派镇金宇天地城1号楼1414室","合肥市肥西县上派镇金宇天地城1号楼1414室","-","房屋建筑工程；市政工程；装饰装修工程，园林绿化施工；水利水电工程；公路交通工程；公路路基工程；建筑智能设计及施工；桥梁工程；体育场地工程；钢结构工程；门窗工程；消防设施安装工程；防腐、防水、保温工程；园林古建筑工程；建筑幕墙工程；环保工程；城市及道路照明、亮化工程；通讯工程；音视频智能系统集成工程；安全技术防范工程；照明音响灯光工程；工程设计；工程造价；广告制作、发布；雕塑设计与制作施工；布展、展览工程设计与施工；清扫保洁；道路保洁；房屋拆除；交通标志标识工程；标识标牌设计与制作；建材五金销售及批发；管道非开挖修复；园林花卉种植、销售；公路工程；苗木培育与销售；河道堤防维修养护；机电设备、废有色金属、生产线回收及销售。（依法须经批准的项目，经相关部门批准后方可开展经营活动）","成功"
"中水淮河规划设计研究有限公司;安徽省交通规划设计研究总院股份有限公司","-","-","0","0","1/1/1970 00:00:00","1/1/1970 00:00:00","-","-","-","-","-","-","-","-","-","-","-","-","-","-","-","-","-","-","-","-","失败"
"安徽四旺机电设备工程有限公司","开业","李万菊","10000000","0","27/2/2017 00:00:00","29/4/2022 00:00:00","-","安徽省","合肥市","瑶海区","0551-62833397","0551-65224837,13365512430,15805601514","15805601514@136.com","952162487@qq.com","91340100MA2NDH324L","91340100MA2NDH324L","340100001905038","MA2NDH32-4","3","有限责任公司(自然人独资)","建筑安装业","-","合肥市瑶海区裕溪路1099号城市之光小区5幢1304","合肥市瑶海区裕溪路1099号城市之光小区5幢1304","-","电梯销售、安装及维护；电梯零配件、酒店厨房设备、空调、消防器材、升降设备、智能化控制设备、五金建材的销售。（依法须经批准的项目，经相关部门批准后方可开展经营活动）","成功"
"安徽铭毅机电设备有限公司","开业","陈启","5200000","0","7/7/2020 00:00:00","5/5/2022 00:00:00","-","安徽省","合肥市","瑶海区","13865978213","-","1670994128@qq.com","-","91340102MA2W02CG2B","91340102MA2W02CG2B","340102000331826","MA2W02CG-2","7","有限责任公司(自然人投资或控股)","金属制品、机械和设备修理业","-","安徽省合肥市瑶海区当涂路325号东城时代广场1幢办公楼、商业B座1903室","安徽省合肥市瑶海区当涂路325号东城时代广场1幢办公楼、商业B座1903室","-","电梯销售、安装、上门维修技术服务；电扶梯及重型设备吊装；楼宇智能化工程；监控报警、系统集成及网络工程；自动控制系统工程；室内外装饰工程；计算机软硬件、通讯产品、五金、建材、门窗、汽车、立体车库、空调、机电设备、消防设备、办公用品、日用百货、家居、服装、农副产品（除粮油）销售；叉车配件销售及上门维修。（依法须经批准的项目，经相关部门批准后方可开展经营活动）","成功"
"江苏兴业环境集团有限公司","开业","胡正勤","100000000","50000000","20/5/2009 00:00:00","28/5/2024 00:00:00","-","江苏省","扬州市","邗江区","0514-87973207","0514-87979960,18952575863,13196681669,0514-87972655,13338857578","350420923@qq.com","xytz87615728@sina.com","91321003689622300J","91321003689622300J","321011000032375","68962230-0","192","有限责任公司(自然人投资或控股)","建筑装饰、装修和其他建筑业","扬州兴业建设园林有限公司","扬州市邗江区杨柳青路169号","江苏省扬州市邗江区金槐路18号","www.xingyeit.com","许可项目：建设工程监理；建设工程设计；建设工程施工（除核电站建设经营、民用机场建设）；住宅室内装饰装修；林木种子生产经营；河道疏浚施工专业作业；建筑劳务分包（依法须经批准的项目，经相关部门批准后方可开展经营活动，具体经营项目以审批结果为准）
一般项目：工程造价咨询业务；技术服务、技术开发、技术咨询、技术交流、技术转让、技术推广；园林绿化工程施工；城市绿化管理；木材加工；建筑用石加工；建筑材料销售；土石方工程施工；机械设备租赁（除依法须经批准的项目外，凭营业执照依法自主开展经营活动）","成功"
"安徽富煌钢构股份有限公司;安阳建工(集团)有限责任公司","-","-","0","0","1/1/1970 00:00:00","1/1/1970 00:00:00","-","-","-","-","-","-","-","-","-","-","-","-","-","-","-","-","-","-","-","-","失败"
"安徽金鹏建设集团股份有限公司;安徽强平建筑工程有限公司","-","-","0","0","1/1/1970 00:00:00","1/1/1970 00:00:00","-","-","-","-","-","-","-","-","-","-","-","-","-","-","-","-","-","-","-","-","失败"
"安徽地锦建设工程有限公司;诚通凯胜生态建设有限公司","-","-","0","0","1/1/1970 00:00:00","1/1/1970 00:00:00","-","-","-","-","-","-","-","-","-","-","-","-","-","-","-","-","-","-","-","-","失败"
"安徽六安公路桥梁工程有限公司","开业","朱昌齐","66000000","66000000","18/12/1999 00:00:00","6/12/2019 00:00:00","-","安徽省","六安市","裕安区","0564-5120838","0564-5123299,0564-3280391,0564-5123287,0564-5123288,0564-5120868","605948867@qq.com","1084665057@qq.com,1084665057@qq.cn,108466505@qq.cn","91341500731683773M","91341500731683773M","341500000023019","73168377-3","51","其他有限责任公司","土木工程建筑业","-","安徽省六安市裕安区文汇中央广场2501-2513室","安徽省六安市裕安区文汇中央广场2501-2513室","www.laglql.com","公路与桥梁施工、养护，市政施工，园林绿化，公路交通工程专业承包，吊装特种设备安装、改造、维修，机械设备租赁。（依法须经批准的项目，经相关部门批准后方可开展经营活动）","成功"
"安徽力升建筑工程有限公司","开业","赵阳","10000000","0","31/5/2016 00:00:00","5/9/2023 00:00:00","-","安徽省","合肥市","肥西县","15055126770","13956063347","727535045@qq.com","1518680018@qq.com,609216980@qq.com,540517540@qq.com","91340123MA2MWKF722","91340123MA2MWKF722","340123000143375","MA2MWKF7-2","0","有限责任公司(自然人投资或控股)","土木工程建筑业","-","安徽省合肥市肥西县上派镇金寨南路与云谷路交口金云国际9号楼2307室","安徽省合肥市肥西县上派镇金寨南路与云谷路交口金云国际9号楼2307室","-","许可项目：各类工程建设活动；地质灾害治理工程施工；房屋建筑和市政基础设施项目工程总承包；建筑智能化工程施工；消防设施工程施工；工程造价咨询业务；电力设施承装、承修、承试；住宅室内装饰装修；电气安装服务；建筑物拆除作业（爆破作业除外）（依法须经批准的项目，经相关部门批准后方可开展经营活动）一般项目：承接总公司工程建设业务；园林绿化工程施工；体育场地设施工程施工；土石方工程施工；对外承包工程；金属门窗工程施工；工程技术服务（规划管理、勘察、设计、监理除外）；水资源管理；工程管理服务（除许可业务外，可自主依法经营法律法规非禁止或限制的项目）","成功"
"楷德电子工程设计有限公司","开业","邹克","260000000","260000000","19/7/2013 00:00:00","29/3/2024 00:00:00","-","四川省","成都市","龙泉驿区","028-65260596","13668104856,028-85114685,13309004106,18180467206,18700879008","yangxh@cckide.com","yangxh_zjkd@163.com,fant_zjkd@163.com","915100000739617429","915100000739617429","510000000322883","07396174-2","727","有限责任公司(自然人投资或控股的法人独资)","房屋建筑业","中建凯德电子工程设计有限公司","四川省成都经济技术开发区（龙泉驿区）成龙大道二段888号综合楼栋","四川省成都经济技术开发区（龙泉驿区）成龙大道二段888号综合楼栋","www.cckide.com","许可项目：建设工程设计；建设工程施工；施工专业作业；特种设备安装改造修理；特种设备设计；电气安装服务；输电、供电、受电电力设施的安装、维修和试验；供电业务。（依法须经批准的项目，经相关部门批准后方可开展经营活动，具体经营项目以相关部门批准文件或许可证件为准）一般项目：货物进出口；工程管理服务；土石方工程施工；技术服务、技术开发、技术咨询、技术交流、技术转让、技术推广；合同能源管理；国内贸易代理；贸易经纪；销售代理；非居住房地产租赁；工业工程设计服务；对外承包工程；碳减排、碳转化、碳捕捉、碳封存技术研发；太阳能发电技术服务；发电技术服务；电子、机械设备维护（不含特种设备）；规划设计管理；专用设备修理；风电场相关装备销售；气候可行性论证咨询服务；电气设备修理；机械设备销售；电气设备销售；机械电气设备销售；环保咨询服务；制冷、空调设备销售；普通机械设备安装服务；标准化服务；光伏设备及元器件销售；建筑材料销售；建筑装饰材料销售；金属材料销售；电力设施器材销售；风力发电技术服务；发电机及发电机组销售；风力发电机组及零部件销售；新能源原动设备销售；通用设备修理；技术进出口；信息咨询服务（不含许可类信息咨询服务）；安全咨询服务；物业管理；工程和技术研究和试验发展。（除依法须经批准的项目外，凭营业执照依法自主开展经营活动）","成功"
"中交第二航务工程局有限公司;安徽水安建设集团股份有限公司","-","-","0","0","1/1/1970 00:00:00","1/1/1970 00:00:00","-","-","-","-","-","-","-","-","-","-","-","-","-","-","-","-","-","-","-","-","失败"
"安徽省交通建设股份有限公司","开业","吴小辉","618924235","441968430","23/2/1993 00:00:00","21/2/2022 00:00:00","-","安徽省","合肥市","庐阳区","0551-65117930","15855144447,15655656252,18255137395,15755108515,13956049177","896132342@qq.com","1529090870@qq.com,ahjjxz@gourgen.com,zhangyaqi@gourgen.com,zhangyaqi@sunriver.cn,424459848@qq.com,95606736@qq.com","913400001489533507","913400001489533507","340000000001724","14895335-0","861","其他股份有限公司(上市)","建筑装饰、装修和其他建筑业","安徽省公路工程总公司","安徽省合肥市庐阳区濉溪路310号","安徽省合肥市庐阳区濉溪路310号","www.gourgen.net","许可项目：建设工程施工；建设工程设计；公路管理与养护；路基路面养护作业；房屋建筑和市政基础设施项目工程总承包；建筑用钢筋产品生产；建筑劳务分包；施工专业作业（依法须经批准的项目，经相关部门批准后方可开展经营活动）一般项目：建筑工程机械与设备租赁；非居住房地产租赁；土石方工程施工；建筑材料销售；建筑用钢筋产品销售；砼结构构件制造；砼结构构件销售；工程管理服务；工程技术服务（规划管理、勘察、设计、监理除外）；水污染治理；水环境污染防治服务；生态恢复及生态保护服务（除许可业务外，可自主依法经营法律法规非禁止或限制的项目）","成功"
"北京城建北方集团（安徽）有限公司;北京城建集团有限责任公司","-","-","0","0","1/1/1970 00:00:00","1/1/1970 00:00:00","-","-","-","-","-","-","-","-","-","-","-","-","-","-","-","-","-","-","-","-","失败"
"华洲电力建设有限公司","开业","李星","101580000","23136000","24/4/2019 00:00:00","26/6/2024 00:00:00","-","湖南省","湘潭市","湘乡市","0551-65320549","0731-56780003,13789316178,13600675000","huazhoudianli@163.com","495499358@qq.com,uazhou@hzdj2019.com","91430381MA4QEQEW67","91430381MA4QEQEW67","430381000049025","MA4QEQEW-6","108","有限责任公司(自然人投资或控股)","土木工程建筑业","-","湖南湘乡经济开发区大将北路30号","湖南湘乡经济开发区大将北路30号","www.hzdljs.cn","太阳能发电工程施工；风能发电工程施工；电力工程施工总承包；输变电工程施工；地基基础工程施工；电力设施承装、承修、承试；机电安装工程施工；城市照明亮化工程施工；水利水电工程施工；消防工程施工；市政公用工程施工；钢结构工程施工；房屋建筑工程施工；土石方工程施工；建筑防水、防腐保温工程施工；建筑装饰装修工程施工；电子与智能化工程施工；通信工程施工；环保工程施工；园林绿化工程施工；古建筑工程施工；起重设备安装工程施工；特种工程（结构补强）工程施工；模板脚手架工程施工；水电安装；城市轨道交通工程建筑；建筑劳务分包；电子设备工程安装服务；新能源汽车充电桩建设、运营及技术服务；工程项目管理服务；工程技术咨询服务；工程造价咨询服务；工程机械设备租赁服务；普通货物道路运输；太阳能光伏电站系统集成；工程设计活动；仪器仪表修理；电气设备制造、销售；机电设备、五金产品销售；电力设施器材、仪器仪表、电工器材、光伏设备及元器件、机械电气设备、其他电气机械及器材制造及销售；光伏项目的技术开发、技术转让及运营管理。（依法须经批准的项目，经相关部门批准后方可开展经营活动）","成功"
"中煤第三建设（集团）有限责任公司","开业","孙学军","1646601900","1646601900","14/6/1989 00:00:00","2/8/2023 00:00:00","-","安徽省","宿州市","埇桥区","17765839060","37212969,18855093842,0557-3710578,010-57403770,0551-63675272","-","-","913413001523400049","913413001523400049","341300000009174","15234000-4","27776","其他有限责任公司","土木工程建筑业","淮北煤矿建设公司","安徽省宿州市汴河西路215号","安徽省合肥市蜀山区习友路898号","www.ccmcgc.com","特种设备设计、安装、改造、维修（压力管道、起重机械），爆破作业设计施工，承包境外工程及境内国际招标工程，上述境外工程所需的设备、材料出口，对外派遣实施上述境外工程所需的劳务人员，矿山工程施工总承包特级，房屋建筑、市政工程、机电安装、公路、铁路工程施工总承包，地基与基础、隧道、城市轨道交通、桥梁、公路路基、土石方、起重设备安装、钢结构、特种专业（特殊凿井、钻井、冻结施工、冷冻安装）工程专业承包，非标准件加工，不动产及设备租赁，建材、钢材、机械、设备、配件、电线、电缆、电器销售，煤矿开采，矿山开采，工程管理咨询，废旧材料回收、加工及销售，园林绿化工程设计、施工及养护，物业管理，工程项目投资和资产运营；道路及设施维护、市政工程维护、停车服务、市政服务、文化体育服务、运动场馆运营管理服务、房屋建筑物维修服务，劳务派遣，水利水电、环保、古建筑工程施工，河湖治理及防洪设施工程，水资源保护和水生态修复工程施工；以下限分支经营：成品油零售，。（依法须经批准的项目，经相关部门批准后方可开展经营活动）","成功"
"安徽文业建设工程有限公司","开业","韩梅高","10000000","0","13/11/2018 00:00:00","6/6/2024 00:00:00","-","安徽省","合肥市","肥东县","15956900293","18905691505,13385602521","16114651682@qq.com","zy44148@sina.com,717610857@qq.com,1066426063@qq.com","91340104MA2T7U3G7A","91340104MA2T7U3G7A","340104000242603","MA2T7U3G-7","10","有限责任公司(自然人投资或控股)","土木工程建筑业","安徽平衿建筑工程有限公司","安徽省合肥市肥东县店埠镇安乐路88号A-322室","安徽省肥东县","-","建筑工程、路桥工程、市政工程、水利水电工程、金属门窗工程、建筑幕墙工程、防水防腐保温工程、建筑装修装饰工程、机场跑道工程、钢结构工程、园林绿化工程、城市照明工程、矿山工程、地基与基础工程、环保工程设计与施工；建筑劳务分包（除劳务派遣）；机械设备租赁；货物专用运输（含冷藏、保鲜）、普通道路货物运输；物流方案设计；装卸搬运、物流配送（快递业务除外）；汽车租赁；汽车零部件销售。（依法须经批准的项目，经相关部门批准后方可开展经营活动）","成功"
"安徽左行建设工程有限公司;南京兴华建筑设计研究院股份有限公司","-","-","0","0","1/1/1970 00:00:00","1/1/1970 00:00:00","-","-","-","-","-","-","-","-","-","-","-","-","-","-","-","-","-","-","-","-","失败"
"机械工业第六设计研究院有限公司","开业","顾晓山","160000000","160000000","7/10/1991 00:00:00","12/7/2023 00:00:00","1991-10-07 至 2061-09-25","河南省","郑州市","中原区","0371-67606480","0838-6201438,0838-6903257,0838-6201474,0838-8201445,0838-6201489","-","-","91410100170054298J","91410100170054298J","410192000000100","17005429-8","1466","有限责任公司(非自然人投资或控股的法人独资)","专业技术服务业","-","郑州市中原区中原西路126号","郑州市中原区中原西路126号","www.sippr.cn","许可项目：建设工程设计；人防工程设计；文物保护工程设计；地质灾害治理工程设计；建筑智能化系统设计；特种设备设计；国土空间规划编制；建设工程勘察；工程造价咨询业务；出版物出版；各类工程建设活动；第二类增值电信业务；建设工程监理；公路工程监理；单建式人防工程监理；建筑智能化工程施工（依法须经批准的项目，经相关部门批准后方可开展经营活动，具体经营项目以相关部门批准文件或许可证件为准）一般项目：工业工程设计服务；海洋工程设计和模块设计制造服务；工程技术服务（规划管理、勘察、设计、监理除外）；规划设计管理；图文设计制作；专业设计服务；工业设计服务；广告制作；土地整治服务；信息系统集成服务；软件开发；工程和技术研究和试验发展；技术服务、技术开发、技术咨询、技术交流、技术转让、技术推广；工程管理服务；对外承包工程；信息技术咨询服务；新材料技术推广服务；普通机械设备安装服务；网络与信息安全软件开发；广告发布（非广播电台、电视台、报刊出版单位）（除依法须经批准的项目外，凭营业执照依法自主开展经营活动）","成功"
"中水淮河规划设计研究有限公司;上海市政工程设计研究总院（集团）有限公司","-","-","0","0","1/1/1970 00:00:00","1/1/1970 00:00:00","-","-","-","-","-","-","-","-","-","-","-","-","-","-","-","-","-","-","-","-","失败"
"淮安市水利勘测设计研究院有限公司","开业","吴昌新","50000000","50000000","30/5/1990 00:00:00","15/8/2023 00:00:00","1990-05-30 至 2040-05-29","江苏省","淮安市","淮安区","13808224353","13514263225,18844592228,18631908920,15246488347,17282302071","hsy@163.net.cn","HSY1@hawater.com,hsy@263.nat.cn","913208914694755130","913208914694755130","320800000033974","46947551-3","289","有限责任公司(自然人投资或控股)","专业技术服务业","淮安市水利勘测设计研究院","淮安经济技术开发区深圳路9号","淮安经济技术开发区深圳路9号","www.jshawater.cn","规划设计、勘察、测绘；技术咨询；工程监理；基桩检测；工程总承包（以上范围按资质证书核定的等级和期限开展经营）；设备租赁、房屋租赁。（依法须经批准的项目，经相关部门批准后方可开展经营活动）","成功"
"青岛市水利勘测设计研究院有限公司","开业","高峰","5000000","0","9/9/1987 00:00:00","11/12/2023 00:00:00","-","山东省","青岛市","市南区","3710331","15053158612,15963204675,13974876637,0532-87763176,0532-85066918","qdslsjyjyb@163.com","qdslsjy@126.com,qdslsjy@163.com,sdqdslsjy@163.com","91370202163580994R","91370202163580994R","370202018030401","16358099-4","144","其他有限责任公司","建筑装饰、装修和其他建筑业","-","青岛市市南区宁夏路288号G1楼501","青岛市崂山区石岭路39号名汇国际1号楼2701","www.qdslsjy.com","许可项目：建设工程设计；建设工程勘察；测绘服务；水利工程建设监理；工程造价咨询业务；建设工程质量检测；水利工程质量检测。（依法须经批准的项目，经相关部门批准后方可开展经营活动，具体经营项目以相关部门批准文件或许可证件为准）一般项目：工程管理服务；水文服务；水利相关咨询服务；非居住房地产租赁；软件开发。（除依法须经批准的项目外，凭营业执照依法自主开展经营活动）","成功"
"安徽省交通规划设计研究总院股份有限公司;安徽交控工程集团有限公司","-","-","0","0","1/1/1970 00:00:00","1/1/1970 00:00:00","-","-","-","-","-","-","-","-","-","-","-","-","-","-","-","-","-","-","-","-","失败"
"巢湖市恒峰建设工程有限公司;雨发建设集团有限公司","-","-","0","0","1/1/1970 00:00:00","1/1/1970 00:00:00","-","-","-","-","-","-","-","-","-","-","-","-","-","-","-","-","-","-","-","-","失败"
"安徽智行建设工程有限公司","开业","周东海","20000000","0","20/10/2016 00:00:00","10/5/2024 00:00:00","-","安徽省","合肥市","长丰县","0552-2823992","18009695239,0551-63539913,18755260623,0551-63519913,19955271532","3312810293@qq.com","402160546@QQ.COM","91340100MA2N1DQ242","91340100MA2N1DQ242","340100001805350","MA2N1DQ2-4","17","有限责任公司(自然人投资或控股)","商务服务业","安徽鑫惠建筑工程项目管理咨询有限公司","安徽省合肥市长丰县左店镇人民政府大院1号楼","合肥市蜀山区长江西路612号蓝光禹洲城","-","许可项目：房屋建筑和市政基础设施项目工程总承包；检验检测服务；消防技术服务；文物保护工程施工；建筑智能化工程施工；各类工程建设活动；电力设施承装、承修、承试；电气安装服务；住宅室内装饰装修；建筑劳务分包；施工专业作业；消防设施工程施工；建筑物拆除作业（爆破作业除外）；建设工程设计（依法须经批准的项目，经相关部门批准后方可开展经营活动）一般项目：消防器材销售；房屋拆迁服务；广告制作；承接总公司工程建设业务；园林绿化工程施工；金属门窗工程施工；建筑材料销售；市政设施管理；工程管理服务；建筑物清洁服务；信息技术咨询服务（除许可业务外，可自主依法经营法律法规非禁止或限制的项目）","成功"
