"company_name","business_status","legal_representative","registered_capital","paid_in_capital","establishment_date","approval_date","business_term","province","city","district","phone","additional_phones","email","additional_emails","unified_social_credit_code","taxpayer_identification_number","business_registration_number","organization_code","insured_personnel_count","company_type","industry","former_name","registered_address","latest_annual_report_address","website","business_scope","match_status"
"安徽浩源建设工程有限公司","开业","朱明强","60000000","17170000","21/2/2013 00:00:00","25/4/2022 00:00:00","2013-02-21 至 2033-02-20","安徽省","合肥市","包河区","13855199685","15255555356,13865513351,0551-65546551,0551-64416551,13323760687","1546487538@qq.com","471237705@qq.com,405455560@qq.com,40446878@qq.com","91340100062482113W","91340100062482113W","340100000749094","06248211-3","34","有限责任公司(自然人投资或控股)","土木工程建筑业","-","合肥市包河区马鞍山南路429号创智广场6幢A座2701","合肥市蜀山区齐云山路新城国际C座1808","-","一般项目：对外承包工程；工程管理服务；园林绿化工程施工；建筑材料销售；市政设施管理（除许可业务外，可自主依法经营法律法规非禁止或限制的项目）许可项目：建设工程施工；建设工程设计；建筑劳务分包；建设工程监理；公路工程监理；公路管理与养护；路基路面养护作业；建筑物拆除作业（爆破作业除外）；城市建筑垃圾处置（清运）；特种设备安装改造修理；文物保护工程施工；地质灾害治理工程施工；输电、供电、受电电力设施的安装、维修和试验（依法须经批准的项目，经相关部门批准后方可开展经营活动，具体经营项目以相关部门批准文件或许可证件为准）","成功"
"河北天森建工集团有限公司","开业","杨浩","106000000","106000000","12/1/2005 00:00:00","4/6/2024 00:00:00","2005-01-12 至 2055-01-11","河北省","石家庄市","裕华区","0311-87162769","0318-2088260,0315-87162777,0335-3692198,0311-66535328,0312-3988289","379890417@qq.com","-","911301007698413198","911301007698413198","130100000011724","76984131-9","335","有限责任公司(自然人投资或控股)","房屋建筑业","-","河北省石家庄市裕华区建设南大街281号中睿府6号商业办公楼106","石家庄市槐安西路88号卓达中苑D座1501室","www.tiansenjituan.com","房屋建筑工程、市政公用工程、地基与基础工程、建筑装饰装修工程、计算机网络工程、公用工程、防水防腐保温工程、机电工程、古建筑工程、建筑幕墙工程、消防设施工程、钢结构工程、土石方工程、园林绿化工程、环保工程、对外承包工程业务（以上经营范围仅限在‘中华人民共和国对外承包工程资格证书’登记核准的范围和有效期内经营）（依法须经批准的项目，经相关部门批准后方可开展经营活动）","成功"
"安徽臻维建设有限公司;安徽省金田建筑设计咨询有限责任公司;安徽省伊家公寓管理有限责任公司","-","-","0","0","1/1/1970 00:00:00","1/1/1970 00:00:00","-","-","-","-","-","-","-","-","-","-","-","-","-","-","-","-","-","-","-","-","失败"
"安徽明帆建设工程有限公司","开业","丁伟","10000000","0","19/11/2018 00:00:00","29/3/2022 00:00:00","-","安徽省","合肥市","蜀山区","0551-64694989","17756087617,18755109421,15305608394","5947225@qq.com","894378224@qq.com,2664623490@qq.com,2457376512@qq.com","91340200MA2T8HMD3U","91340200MA2T8HMD3U","340200000418169","MA2T8HMD-3","9","有限责任公司(自然人投资或控股)","建筑装饰、装修和其他建筑业","-","安徽省合肥市高新区玉兰大道777号双赢大厦1313室","安徽省合肥市高新区玉兰大道777号双赢大厦1313室","-","市政公用工程、水利水电工程、公路工程、建筑工程、机电工程、港口与航道工程、桥梁工程、建筑装修装饰工程、土石方工程、地基基础工程、钢结构工程、城市及道路照明工程、建筑幕墙工程、环保工程、河湖整治工程、防水防腐保温工程、模板脚手架工程、建筑机电安装工程、古建筑工程、公路交通工程、公路路面工程、公路路基工程、水利水电机电安装工程、消防设施工程、电力工程、通信工程、电子与智能化工程施工，生态农业开发，体育场馆设施安装，城市园林绿化，房屋、设备拆除，保洁服务，机械设备租赁，五金、机电产品、新型建材生产设备、电子智能化设备、消防设备的销售、安装、调试、维护，承装（修、试）电力设施。（依法须经批准的项目，经相关部门批准后方可开展经营活动）","成功"
"南通市交通建设咨询监理有限公司","开业","杨莉","10800000","10800000","23/11/1998 00:00:00","31/10/2022 00:00:00","-","江苏省","南通市","崇川区","13832948941","0513-83557802,0513-83552163,0513-83530056,3530006","1455978485@qq.com","ntjtjl@sina.com","91320602711519773H","91320602711519773H","320600000006822","71151977-3","154","有限责任公司(非自然人投资或控股的法人独资)","土木工程建筑业","-","南通市崇川区工农南路128号天宝国能中心19层","南通市崇川区工农南路128号天宝国能中心19层","www.ntjtjl.cn","公路工程、桥隧工程、交通工程、市政公用工程、港口与航道工程、水运工程、房屋建筑工程、园林景观工程的工程监理、质量检测、技术咨询、技术服务、项目管理；招标代理。（依法须经批准的项目，经相关部门批准后方可开展经营活动）
许可项目：建设工程监理（依法须经批准的项目，经相关部门批准后方可开展经营活动，具体经营项目以审批结果为准）
一般项目：环保咨询服务（除依法须经批准的项目外，凭营业执照依法自主开展经营活动）","成功"
"合肥瑞盛房地产开发有限公司;华东建筑设计研究院有限公司;安徽省城建设计研究总院股份有限公司","-","-","0","0","1/1/1970 00:00:00","1/1/1970 00:00:00","-","-","-","-","-","-","-","-","-","-","-","-","-","-","-","-","-","-","-","-","失败"
"安徽中安雨阳建设有限公司","开业","刘美玲","36360000","12000000","27/11/2003 00:00:00","3/8/2022 00:00:00","2003-11-27 至 2039-11-26","安徽省","合肥市","长丰县","15256581820","0551-65501986,13905690946","9135139462@qq.com","649894774@qq.com,815775939@qq.com","91340100756808093D","91340100756808093D","340100000126865","75680809-3","25","有限责任公司(自然人投资或控股)","林业","-","安徽省合肥市长丰县朱巷镇庞孤堆村长白路北侧1幢101室","安徽省合肥市长丰县朱巷镇庞孤堆村长白路北侧1幢101室","-","园林绿化工程、市政工程、仿古建筑工程、公路工程、桥梁工程、建筑工程、建筑装修装饰工程、建筑机电安装工程、土石方工程设计与施工；社区道路、房屋维修；塑钢门窗制作、设计、安装及销售；建筑装饰材料、五金百货、电线电缆、日用百货的销售；苗木花卉种植及销售；农副产品研发及销售；城市及道路照明工程；照明产品销售、服务；安全防范技术服务；安防工程、网络工程的施工、设计、安装；生态环保、工程劳务服务；工程咨询；建筑智能化工程，智能建筑系统集成，钢结构工程，木工装饰活动（依法须经批准的项目，经相关部门批准后方可开展经营活动）","成功"
"安徽聚顺市政工程有限公司","开业","徐礼","10600000","5160000","18/1/2016 00:00:00","18/10/2022 00:00:00","2016-01-18 至 2066-01-17","安徽省","合肥市","肥西县","13616125687","0551-62350643,15256949752,13616125678","952786439@qq.com","1724497097@qq.com,13616125687@qq.com","91340124MA2MRYQ81R","91340124MA2MRYQ81R","340124000013654","MA2MRYQ8-1","11","有限责任公司(自然人投资或控股)","土木工程建筑业","-","安徽省合肥市肥西县棋石路与书箱路交口禹州华侨城二期24#205室","安徽省合肥市肥西县棋石路与书箱路交口禹州华侨坡二期24＃205室","-","一般项目：市政设施管理；广告制作；房屋拆迁服务；土石方工程施工；园林绿化工程施工；体育场地设施工程施工；住宅水电安装维护服务；建筑物清洁服务；污水处理及其再生利用；建筑工程机械与设备租赁；建筑装饰材料销售；制冷、空调设备销售；休闲观光活动；特种设备销售；市场营销策划；水污染治理；工程管理服务；土地整治服务；五金产品零售；园区管理服务（除许可业务外，可自主依法经营法律法规非禁止或限制的项目）许可项目：建设工程施工；建筑物拆除作业（爆破作业除外）；住宅室内装饰装修；建设工程设计；建筑智能化系统设计；公路管理与养护；施工专业作业；文物保护工程施工（依法须经批准的项目，经相关部门批准后方可开展经营活动，具体经营项目以相关部门批准文件或许可证件为准）","成功"
"鹿景建设集团有限公司","开业","温亚川","60000000","60000000","16/6/2003 00:00:00","17/6/2024 00:00:00","2003-06-16 至 2033-06-15","江西省","南昌市","红谷滩区","13036212668","18179104405,18070286300,0791-86665811,0791-6665800,15270021229","2294368432@qq.com","980857925@qq.com","91360100751108581R","91360100751108581R","360100210015211","75110858-1","34","有限责任公司(自然人投资或控股)","公共设施管理业","鹿景园林建设集团有限公司","江西省南昌市红谷滩新区金融大街上海湾商业街写字楼1208室","江西省南昌市红谷滩新区金融大街上海湾商业街写字楼1208室","-","园林绿化工程、园林景观工程、园林古建工程的施工和养护；市政工程、房屋建筑工程、道路工程、桥梁工程、机电工程、水电工程、水利工程、土石方工程、城市及道路照明工程、建筑装修装饰工程；环保工程、河湖整治工程服务；地质灾害治理服务；风景园林设计规划；喷泉设施设计、安装；造林苗、城镇绿化苗、经济林苗、花卉等的生产（仅限下属分支机构经营）、批发、零售（依法须经批准的项目经相关部门批准后方可开展经营活动）","成功"
"上海尤安建筑设计股份有限公司;煤炭工业合肥设计研究院有限责任公司","-","-","0","0","1/1/1970 00:00:00","1/1/1970 00:00:00","-","-","-","-","-","-","-","-","-","-","-","-","-","-","-","-","-","-","-","-","失败"
"江苏山水环境建设集团股份有限公司;安徽博德建设工程有限公司","-","-","0","0","1/1/1970 00:00:00","1/1/1970 00:00:00","-","-","-","-","-","-","-","-","-","-","-","-","-","-","-","-","-","-","-","-","失败"
"安徽运胜建设工程有限公司","开业","余金杳","50000000","0","27/12/2018 00:00:00","25/6/2023 00:00:00","-","安徽省","安庆市","望江县","0556-7365059","15056668059,15056660569,18155618163,15391835590","15056668059@163.com","809115535@qq.com,15056668059@qq.com","91340827MA2TCKHQ8G","91340827MA2TCKHQ8G","340827000066665","MA2TCKHQ-8","0","有限责任公司(自然人投资或控股)","房屋建筑业","-","安徽省安庆市望江县雷阳街道太华公路西侧AB17幢","安徽省安庆市望江县雷阳街道太华公路西侧AB17幢","-","水利水电工程、建筑工程、市政公用工程、公路工程、环保工程、建筑装饰装修工程、桥梁工程、土石方工程、园林绿化工程、防腐保温工程、消防工程、公路养护工程、城市及道路照明工程、古建筑工程、机电工程、起重设备安装工程、钢结构工程、隧道工程、建筑防水工程设计、施工；钢结构工程专业承包；模板脚手架专业承包；建筑劳务分包；建筑工程机械与设备、模板脚手架租赁；建材销售。（依法须经批准的项目，经相关部门批准后方可开展经营活动）***","成功"
"中国建筑第八工程局有限公司","开业","周可璋","15218000000","15218000000","29/9/1998 00:00:00","14/6/2023 00:00:00","-","上海市","市辖区","浦东新区","15530258798","022-8359093,0371-65803280,18609825340,010-68501111,0951-6022265","-","-","9131000063126503X1","9131000063126503X1","310000000065107","63126503-X","4271","有限责任公司(非自然人投资或控股的法人独资)","房屋建筑业","中国建筑第八工程局","中国（上海）自由贸易试验区世纪大道1568号27层","中国（上海）自由贸易试验区世纪大道1568号27层","8bur.cscec.com","房屋建筑、公路、铁路、市政公用、港口与航道、水利水电各类别工程的咨询、设计、施工、总承包和项目管理，化工石油工程，电力工程，基础工程，装饰工程，工业筑炉，城市轨道交通工程，园林绿化工程，线路、管道、设备的安装，混凝土预制构件及制品，非标制作，建筑材料生产、销售，建筑设备销售，建筑机械租赁，房地产开发，自有房屋租赁，物业管理，从事建筑领域内的技术转让、技术咨询、技术服务，企业管理咨询，商务信息咨询，经营各类商品和技术的进出口，但国家限定公司经营或禁止进出口的商品及技术除外。
【依法须经批准的项目，经相关部门批准后方可开展经营活动】","成功"
"中铁十五局集团有限公司","开业","黄昌富","3000000000","1590210300","2/4/2001 00:00:00","26/3/2024 00:00:00","-","上海市","市辖区","静安区","18639783773","18062435168,0571-87630265,020-84986039,021-66119097,13939162853","-","-","913100001699534723","913100001699534723","410000100013164","16995347-2","607","有限责任公司(非自然人投资或控股的法人独资)","土木工程建筑业","-","上海市静安区共和新路666号6楼","上海市共和新路666号","cr15g.crcc.cn","铁路、公路、房屋建设、水利水电、市政公用建设工程施工，建设工程设计，桥梁、隧道、公路路面、公路路基、铁路铺轨架梁建设工程专业施工，地质灾害治理工程施工甲级，承包与其实力、规模、业绩相适应的国外工程项目，对外派遣实施上述境外工程所需的劳务人员，自有设备、房屋租赁，计量认证（限分支机构凭证经营），从事建筑科技专业领域内的技术开发、技术转让、技术咨询、技术服务，铁路货物运输、铁路旅客运输、铁路运输辅助活动，城市轨道交通运营服务（限分支机构经营），企业管理，代理记账，机械设备、建筑材料销售，物业管理，停车场经营，会务服务。 【依法须经批准的项目，经相关部门批准后方可开展经营活动】","成功"
"龙建路桥股份有限公司","开业","田玉龙","1014777546","286339763","18/1/1993 00:00:00","11/3/2024 00:00:00","-","黑龙江省","哈尔滨市","南岗区","13354509217","18070604444,13936433083,0451-88140158,17645453000,17745144051","-","-","91230100606102976R","91230100606102976R","230000100004258","60610297-6","882","其他股份有限公司(上市)","土木工程建筑业","-","黑龙江省哈尔滨市南岗区长江路368号","哈尔滨市南岗区嵩山路109号办公楼","www.longjianlq.com","承包与其实力、规模、业绩相适应的国外工程项目，对外派遣实施上述境外工程所需的劳务人员。公路工程施工总承包（特级），市政公用工程施工总承包壹级（市政公用工程包括：给水工程、排水工程、燃气工程、热力工程、道路工程、桥梁工程、城市隧道工程、公共交通工程、轨道交通工程、环境卫生工程、照明工程、绿化工程；市政综合工程包括：城市道路和桥梁、供水、排水、中水、燃气、热力、电力、通信、照明等中的任意两类以上的工程）；公路路面工程专业承包（壹级），公路路基工程专业承包（壹级），公路管理与养护，桥梁工程专业承包（壹级），隧道工程专业承包（贰级），园林绿化工程施工， 铁路工程服务，工程设计（公路行业甲级，可从事资质证书许可范围内相应的建设工程总承包业务以及项目管理和相关的技术与管理服务）。公路桥梁建设技术开发，建筑工程施工，工程监理服务，建筑劳务分包，矿产资源（非煤矿山）开采，建筑用石加工，砼结构构件制造，住宅装饰和装修，销售建筑材料，建筑工程机械与设备经营租赁，普通道路货运运输，房屋及场地租赁，检验检测服务，工程和技术研究试验发展，通勤服务，餐饮服务，单位后勤管理服务，企业总部管理，工程管理服务，鉴证咨询服务，技术服务，信息技术咨询服务。水泥制品制造、企业管理、人力资源服务（不含职业中介服务）、销售建材，物业管理、建筑装饰装修设计施工、房地产开发经营、货物或技术进出口（国家禁止或涉及行政审批的货物和技术进出口除外）、工程信息咨询、机械设备租赁。","成功"
"中交第三公路工程局有限公司","开业","蔡唐涛","2156187178","0","8/3/2004 00:00:00","11/4/2024 00:00:00","-","北京市","市辖区","东城区","010-84927315","18832041125,18376219676,13903705325,13831511329,13116556027","-","-","911100007596009847","911100007596009847","110000006724788","75960098-4","5219","其他有限责任公司","房屋建筑业","-","北京市东城区安定门外大街丙88号801","北京市东城区安定门外大街丙88号801","www.zjsgj.com.cn","工程设计；施工总承包；专业承包；工程咨询；物业管理；汽车租赁（不含九座以上）；租赁机械设备；货物进出口；技术进出口；代理进出口。（市场主体依法自主选择经营项目，开展经营活动；工程设计以及依法须经批准的项目，经相关部门批准后依批准的内容开展经营活动；不得从事国家和本市产业政策禁止和限制类项目的经营活动。）","成功"
"湖南路桥建设集团有限责任公司","开业","王术飞","3003000000","3003000000","8/4/1981 00:00:00","25/12/2023 00:00:00","-","湖南省","长沙市","雨花区","18874384597","13548752450,18073099980,0731-85453328,15200571649,18932460082","-","-","91430000183763763N","91430000183763763N","430000000020158","18376376-3","2767","有限责任公司(非自然人投资或控股的法人独资)","房屋建筑业","湖南路桥建设集团公司","长沙市雨花区韶山南路239号","湖南省长沙市雨花区韶山南路239号","www.hnrb.cn","许可项目：建设工程施工；建设工程设计；建设工程监理；公路工程监理；房地产开发经营；供电业务；公路管理与养护。（依法须经批准的项目，经相关部门批准后方可开展经营活动，具体经营项目以相关部门批准文件或许可证件为准）一般项目：工程管理服务；工程造价咨询业务；物业管理；园林绿化工程施工；以自有资金从事投资活动；自有资金投资的资产管理服务；通用设备修理；专用设备修理；交通设施维修；金属结构制造；金属结构销售；金属材料制造；金属材料销售；租赁服务（不含许可类租赁服务）；非居住房地产租赁；非融资担保服务；企业管理；办公用品销售；太阳能发电技术服务；建筑用石加工；新型建筑材料制造（不含危险化学品）；建筑材料销售；非金属矿物制品制造；非金属矿及制品销售；轻质建筑材料制造；轻质建筑材料销售；砼结构构件制造；砼结构构件销售；水泥制品制造；水泥制品销售。（除依法须经批准的项目外，凭营业执照依法自主开展经营活动）","成功"
"安徽建工公路桥梁建设集团有限公司","开业","钱申春","2215324154","1564827179","27/10/1986 00:00:00","18/6/2024 00:00:00","-","安徽省","合肥市","蜀山区","0551-65141190","0551-65141024,0314-2066866,15209856937,18655195845,93400389","1131077145@qq.com","ahlq@ahluqiao.com,1823164107@qq.com","91340000148941069W","91340000148941069W","340000000004077","14894106-9","2237","有限责任公司(国有控股)","土木工程建筑业","安徽省公路桥梁工程有限公司","安徽省合肥市蜀山区黄山路445号","安徽省合肥市蜀山区黄山路445号","-","许可项目：建设工程施工；建设工程设计；建设工程勘察；建筑劳务分包（依法须经批准的项目，经相关部门批准后方可开展经营活动，具体经营项目以相关部门批准文件或许可证件为准）一般项目：对外承包工程；园林绿化工程施工；土石方工程施工；建筑工程机械与设备租赁；特种设备出租；建筑材料生产专用机械制造；建筑工程用机械制造；水泥制品制造（除许可业务外，可自主依法经营法律法规非禁止或限制的项目）","成功"
"湖南一特医疗股份有限公司","开业","张意龙","32000000","32000000","23/7/2003 00:00:00","5/1/2024 00:00:00","-","湖南省","长沙市","岳麓区","13755009839","0731-82760901,13874923115,0731-88905408,18874828515,0731-82760902","18707486711@qq.com","-","914300007506482283","914300007506482283","430193000004494","75064822-8","255","股份有限公司(非上市、自然人投资或控股)","建筑装饰、装修和其他建筑业","湖南一特电子医用工程股份有限公司","长沙高新开发区火炬城Ｍ5组团１栋","长沙湘江新区麓天路21号","www.eter.cn","许可项目：第二类医疗器械生产；特种设备制造；建设工程施工；建设工程设计；特种设备设计；医疗器械互联网信息服务；第三类医疗器械经营；建筑智能化系统设计。（依法须经批准的项目，经相关部门批准后方可开展经营活动，具体经营项目以相关部门批准文件或许可证件为准）一般项目：专用设备制造（不含许可类专业设备制造）；通用设备制造（不含特种设备制造）；工业控制计算机及系统制造；金属包装容器及材料制造；电子专用设备制造；金属加工机械制造；特种设备销售；工业工程设计服务；互联网销售（除销售需要许可的商品）；工业互联网数据服务；工程和技术研究和试验发展；基于云平台的业务外包服务；工业自动控制系统装置制造；机械电气设备销售；金属包装容器及材料销售；建筑装饰材料销售；安防设备销售；软件销售；信息安全设备销售；工业自动控制系统装置销售；数字视频监控系统销售；互联网设备销售；计算器设备销售；物联网设备销售；第二类医疗器械销售；技术服务、技术开发、技术咨询、技术交流、技术转让、技术推广；配电开关控制设备销售；电子产品销售；电气设备销售；第一类医疗器械销售；气体压缩机械销售；工业控制计算机及系统销售；计算机软硬件及辅助设备批发；可穿戴智能设备销售；软件开发；第二类医疗器械租赁；工程管理服务；机械设备研发；安全技术防范系统设计施工服务；信息系统集成服务；住房租赁；电子、机械设备维护（不含特种设备）；工业设计服务；工程技术服务（规划管理、勘察、设计、监理除外）；专业设计服务；租赁服务（不含许可类租赁服务）；物联网技术服务；平面设计；以自有资金从事投资活动。（除依法须经批准的项目外，凭营业执照依法自主开展经营活动）","成功"
"安徽国辉电力建设有限公司","开业","梁胜","100000000","26000000","20/12/2016 00:00:00","10/10/2023 00:00:00","-","安徽省","合肥市","瑶海区","13966336999","0551-63810727,15357902751,18788876599,15715606898,0551-66033402","zhygp@sohu.com","-","91340100MA2N9Q2UXR","91340100MA2N9Q2UXR","340191000103159","MA2N9Q2U-X","46","有限责任公司(自然人独资)","建筑安装业","-","合肥市瑶海区大兴镇裕溪路247号弘皓大厦八楼","合肥市瑶海区大兴镇裕溪路247号弘皓大厦八楼","www.guohuipower.com","电力工程；电力设备安装、调试、维修、试验；电力工程设计；电力安装工程策划；城市道路照明工程；市政工程；房屋建筑工程；水电安装工程；园林绿化工程；路桥建筑工程；防水防腐保温工程；电工电料，五金交电、机电产品、建材销售；建筑劳务分包。（依法须经批准的项目，经相关部门批准后方可开展经营活动）","成功"
