"company_name","business_status","legal_representative","registered_capital","paid_in_capital","establishment_date","approval_date","business_term","province","city","district","phone","additional_phones","email","additional_emails","unified_social_credit_code","taxpayer_identification_number","business_registration_number","organization_code","insured_personnel_count","company_type","industry","former_name","registered_address","latest_annual_report_address","website","business_scope","match_status"
"合肥工大共达工程检测试验有限公司","开业","完海鹰","30000000","30000000","26/7/1995 00:00:00","21/9/2023 00:00:00","1995-07-26 至 2059-01-16","安徽省","合肥市","包河区","0551-69118991","0551-67330503,0551-62901125,18556558151,13866125506,0551-62901522","13866125506@163.com","-","913401001491915621","913401001491915621","340100000165590","14919156-2","295","有限责任公司(非自然人投资或控股的法人独资)","建筑装饰、装修和其他建筑业","-","合肥市包河经济开发区花园大道369号合工大智能院智能研发中心B区","合肥市包河经济开发区花园大道369号合工大智能院智能研发中心B区","www.hfgdjc.com","建设工程、交通工程、水利电力工程及铁路工程质量检测；桥隧与道路工程检测；轨道工程检测；消防检测；人防检测；防雷检测；节能检测；环境检测；管道检测；管道评估；工程结构可靠性鉴定；建筑物抗震性能评估；工程勘察；工程监测；测绘工程；地理信息工程；绿色建筑与绿色建材评价标识及咨询；工程检测技术研究、技术咨询、技术服务。（依法须经批准的项目，经相关部门批准后方可开展经营活动）","成功"
"安徽省建院工程质量检测有限公司","开业","仇伟","5000000","5000000","11/7/2006 00:00:00","3/7/2024 00:00:00","-","安徽省","合肥市","蜀山区","18919765238","13705606973,34131100,18010019450,13965003739,0551-62899396","949850280@qq.com","949850280@QQ.COM","913401007901365693","913401007901365693","340107000002750","79013656-9","203","其他有限责任公司","商务服务业","安徽宏晟建设工程质量检测有限公司","安徽省合肥市经济技术开发区蓬莱路718号-2","安徽省合肥市经济技术开发区蓬莱路718号-2","www.ahsjyjc.cn","建筑工程质量检测；公路水运工程试验检测；水利电力工程及铁路质量检测；建设工程结构可靠性鉴定；建筑物及岩土工程检测与监测；建设工程测试咨询及测试技术研发；消防检测；雷电防护装置检测；雷电灾害风险评估；地质勘查；测绘工程；地理信息工程；地震工程；节能评估；环境检测；工程检测；消防安全评估；绿色建筑与绿色建材评价标识及咨询；管道检测；管道评估；人防工程质量检测。（依法须经批准的项目，经相关部门批准后方可开展经营活动）","成功"
"合肥工大工程试验检测有限责任公司","开业","崔永健","1352900","1352800","19/8/2005 00:00:00","27/5/2024 00:00:00","2005-08-19 至 2056-08-18","安徽省","合肥市","肥东县","0551-64283128","0551-62919360,0551-65191888,0551-62919361,13855082020,0551-65198815","hfuteti@sina.com","hfuteti@163.com","91340122779065528Q","91340122779065528Q","340100000006640","77906552-8","504","其他有限责任公司","居民服务业","-","肥东县撮镇镇新安社区燎原路西侧工大建科楼","合肥市包河区花园大道369号合肥工业大学智能制造技术研究院","www.hfuteti.com","许可项目：检验检测服务；雷电防护装置检测；建设工程质量检测；水利工程质量检测；室内环境检测；建设工程勘察；测绘服务（依法须经批准的项目，经相关部门批准后方可开展经营活动，具体经营项目以相关部门批准文件或许可证件为准）一般项目：公路水运工程试验检测服务；消防技术服务；工程技术服务（规划管理、勘察、设计、监理除外）；技术服务、技术开发、技术咨询、技术交流、技术转让、技术推广；信息技术咨询服务；建设工程消防验收现场评定技术服务；工程和技术研究和试验发展；安全咨询服务（除许可业务外，可自主依法经营法律法规非禁止或限制的项目）","成功"
"群毅建设工程有限公司","开业","翟清胜","50000000","110000","19/9/2018 00:00:00","29/5/2023 00:00:00","-","安徽省","合肥市","长丰县","0551-65340211","15056083321,0551-65112255,0551-65112322","1458490817@qq.com","-","91340100MA2T351U9Q","91340100MA2T351U9Q","340100002188235","MA2T351U-9","9","有限责任公司(自然人投资或控股)","房屋建筑业","-","安徽省合肥市长丰县双墩镇濛河路1号创孵中心G310","安徽省合肥市长丰县双墩镇濛河路1号创孵中心G310","-","建筑工程；园林绿化工程；园林景观设计；市政公用工程；水利工程；室内外装饰装修工程，环保工程；防水防腐工程；外墙保温工程；公路交通工程；城市道路照明工程；体育场地设施工程；安全防范工程设计与施工；房屋修缮工程；钢结构工程；地基基础工程；消防设施工程；古建筑工程；空气净化工程；建筑智能化工程设计、施工；计算机系统集成；展览展示服务；房屋拆除；保洁服务；企业信息咨询；工程造价信息咨询；建筑劳务分包；金属门窗、标牌、灯箱安装；机电设备安装；国内广告设计、制作、发布。（依法须经批准的项目，经相关部门批准后方可开展经营活动）","成功"
"安徽霄泽建设工程有限公司","开业","梁志祥","41000000","41000000","7/3/2023 00:00:00","2/2/2024 00:00:00","-","安徽省","合肥市","巢湖市","13635651719","-","2503324285@qq.com","-","91340123MA8Q4U7L58","91340123MA8Q4U7L58","340123000495597","MA8Q4U7L-5","0","有限责任公司(自然人投资或控股)","土木工程建筑业","安徽霄泽建筑工程有限公司","安徽省合肥市巢湖市烔炀镇兴烔路与庙忠路交叉处丽都国际花园13栋01铺","安徽省合肥市巢湖市烔炀镇兴烔路与庙忠路交叉处丽都国际花园13栋01铺","-","许可项目：建设工程施工；建设工程设计；住宅室内装饰装修；电气安装服务（依法须经批准的项目，经相关部门批准后方可开展经营活动，具体经营项目以相关部门批准文件或许可证件为准）一般项目：消防技术服务；专业设计服务；园林绿化工程施工；体育场地设施工程施工；土石方工程施工；金属门窗工程施工；建筑工程机械与设备租赁；五金产品零售；建筑材料销售（除许可业务外，可自主依法经营法律法规非禁止或限制的项目）","成功"
"合肥工业大学设计院（集团）有限公司","开业","张彤阳","60200000","60200000","15/11/1994 00:00:00","4/9/2023 00:00:00","-","安徽省","合肥市","包河区","0551-2919506","0551-62903785,0551-62903899,0551-68233026,18605519180,0551-4650919","zhglb@hfutdi.cn","hfutadi@163.com","91340100149185568Q","91340100149185568Q","340100000218423","14918556-8","582","有限责任公司(非自然人投资或控股的法人独资)","居民服务业","合肥工业大学建筑设计研究院","安徽省合肥市包河区花园大道369号","合肥市包河区花园大道369号","www.hfutdi.cn","许可项目：建设工程设计；国土空间规划编制；建筑智能化系统设计；文物保护工程勘察；文物保护工程设计；建设工程勘察；建设工程监理（依法须经批准的项目，经相关部门批准后方可开展经营活动，具体经营项目以相关部门批准文件或许可证件为准）一般项目：工程管理服务；工程造价咨询业务；人防工程设计；专业设计服务；工程技术服务（规划管理、勘察、设计、监理除外）；规划设计管理；招投标代理服务；政府采购代理服务（除许可业务外，可自主依法经营法律法规非禁止或限制的项目）","成功"
"安徽华策建设有限公司","开业","吕明清","42680000","42680000","6/4/2015 00:00:00","27/8/2019 00:00:00","2015-04-06 至 2045-04-05","安徽省","合肥市","肥东县","0551-65555257","0551-65569789,15056330760,15155117776,0556-4967802","649969142@qq.com","71726824@qq.com,708995716@qq.com,24317550@qq.com,740946034@qq.com","91340122336677883X","91340122336677883X","340122000101371","33667788-3","19","有限责任公司(自然人投资或控股)","房屋建筑业","-","肥东县店埠镇人民路检察院宿舍楼104号","肥东县店埠镇人民检察院宿舍楼104号","-","房屋建设工程、防腐保温工程、地基与基础工程、钢结构工程、公路工程、公路养护工程、公路交通工程、市政公用工程、机场场道工程、水利水电工程、机电安装工程、河湖整治工程、堤防工程、水工大坝工程、电力工程（不含承装（修、试）电力设施）、电子工程、安防工程、环保工程、园林绿化工程、管道工程（不含压力管道）、特种专业工程（不含特种设备）、建筑装修装饰工程、建筑幕墙工程、建筑智能化工程、消防设施工程、土石方工程、城市及道路照明工程、园林古建筑工程、矿山工程设计与施工；工程机械设备、环保机械设备租赁及销售；桥梁维修及加固；园林绿化养护；农村改厕施工；化粪池安装；劳务分包；交通道路标志（标识）牌生产、制作。（依法须经批准的项目，经相关部门批准后方可开展经营活动）","成功"
"安徽巢炀建设工程有限公司","开业","赵玲","51800000","10200000","18/11/2014 00:00:00","8/11/2023 00:00:00","2014-11-18 至 2044-11-17","安徽省","合肥市","肥东县","0551-65193311","18055217044,13855403232,0551-67801002,0551-65191373,13855103232","2431652475@qq.com","2585373522@qq.com,251261677@qq.com,284888167@qq.com","913401003946328868","913401003946328868","340100001130667","39463288-6","30","有限责任公司(自然人投资或控股)","房屋建筑业","安徽巢炀建筑劳务有限公司","安徽省合肥市肥东县石塘镇石塘区银桥街26号B幢113室","合肥市肥东县石塘镇石塘区银桥街26号B幢113室","-","一般项目：对外承包工程；园林绿化工程施工；体育场地设施工程施工；普通机械设备安装服务；室内木门窗安装服务；土石方工程施工；金属门窗工程施工；建筑工程机械与设备租赁；工程管理服务；工程造价咨询业务；环境卫生公共设施安装服务；住宅水电安装维护服务；家用电器安装服务；汽车拖车、求援、清障服务；建筑物清洁服务；建筑材料销售；电线、电缆经营；建筑装饰材料销售；建筑防水卷材产品销售；地板销售；水泥制品销售；建筑用钢筋产品销售；建筑陶瓷制品销售；砖瓦销售；石棉水泥制品销售；集贸市场管理服务；建筑砌块销售；五金产品零售；特种劳动防护用品销售；防腐材料销售；保温材料销售；门窗销售；广告设计、代理；图文设计制作；规划设计管理；平面设计；集成电路设计；广告制作；市场营销策划（除许可业务外，可自主依法经营法律法规非禁止或限制的项目）许可项目：建设工程施工；输电、供电、受电电力设施的安装、维修和试验；建设工程施工（除核电站建设经营、民用机场建设）；民用核安全设备安装；电气安装服务；舞台工程施工；住宅室内装饰装修；施工专业作业；建筑劳务分包；建筑物拆除作业（爆破作业除外）；人防工程防护设备安装；建设工程监理；建设工程勘察；人防工程设计；建筑智能化系统设计；城市建筑垃圾处置（清运）；建设工程设计（依法须经批准的项目，经相关部门批准后方可开展经营活动，具体经营项目以相关部门批准文件或许可证件为准）","成功"
"安徽自力建筑工程有限公司","开业","王永强","40400000","10900000","5/2/2018 00:00:00","23/3/2023 00:00:00","-","安徽省","合肥市","瑶海区","0551-66331185","13805692148","1455238968@qq.com","-","91340102MA2RGX8U9W","91340102MA2RGX8U9W","340102000060709","MA2RGX8U-9","15","有限责任公司(自然人投资或控股)","建筑装饰、装修和其他建筑业","-","合肥市瑶海区当涂路东天使苑铂金时代1002","合肥市瑶海区当涂路东天使苑铂金时代1002","-","房屋建筑工程、防水防腐保温工程、园林绿化工程、土石方工程、地基与基础工程、城市道路照明工程、机电设备安装工程、建筑装饰装修工程、市政工程、钢结构工程、环保工程、堤防工程、公路工程、电力工程、水利水电工程、河湖整治工程、建筑墙幕工程施工；装配式建筑安装、施工；预制构件安装、施工；建筑智能化系统、模版、脚手架安装；建筑劳务分包（除劳务派遣）。（依法须经批准的项目，经相关部门批准后方可开展经营活动）","成功"
"苏州市兴邦化学建材有限公司","开业","毛荣良","30000000","7300000","26/12/2001 00:00:00","13/9/2021 00:00:00","-","江苏省","苏州市","相城区","13913131989","15950059523,0512-68325996,0512-66707196,65351918,13901543512","liping.zhang@szsunbo.com","dyh@szsunbo.com","91320507737071348B","91320507737071348B","320507000009304","73707134-8","134","有限责任公司(自然人投资或控股)","非金属矿物制品业","-","苏州市相城区望亭镇华阳村新华村路318号","苏州市相城区望亭镇华阳村新华村路318号","www.xbcbm.com","生产、研制、销售：磺化密胺树脂、耐磨材料、彩色水泥、塑料模具、钢纤维混凝土井盖、预制构件、井盖机械制造、复合型井盖（上述范围涉及资质的，凭资质经营）；生产、销售：缓凝剂、聚羧酸盐复合减水剂项目及研制项目由下设分支机构经营；销售：化工产品（不含危化品）、建材产品、金属井盖；自营和代理各类商品及技术的进出口业务（国家限定企业经营或禁止进出口的商品和技术除外）。（依法须经批准的项目，经相关部门批准后方可开展经营活动）
一般项目：技术服务、技术开发、技术咨询、技术交流、技术转让、技术推广（除依法须经批准的项目外，凭营业执照依法自主开展经营活动）","成功"
"安徽格蕴市政建材有限公司","开业","王国庆","10000000","5000000","14/12/2007 00:00:00","29/8/2018 00:00:00","2007-12-14 至 2037-12-13","安徽省","合肥市","瑶海区","13485679932","15156022306,13855181622,18715047351,18855127042,0551-65426908","857320169@qq.com","474519298@qq.com","91340100669479690J","91340100669479690J","340121000003283","66947969-0","31","有限责任公司(自然人投资或控股)","非金属矿物制品业","-","安徽省合肥市新站区三十头镇三元大道","安徽省合肥市新站区三十头镇三元大道","www.ahgyjc.com","市政设施产品研发、销售、安装施工；水泥预制品、通用建材销售；复合井盖生产、销售；建材机械销售、安装技术咨询。","成功"
"华升富士达电梯有限公司","开业","陶永铭","708040000","708040000","12/12/1995 00:00:00","14/6/2024 00:00:00","1995-12-12 至 2035-12-11","河北省","廊坊市","广阳区","025-84700450","010-88488618,13686826387,0316-6088475,0316-2606511,0316-6849026","plan@fujitec.com.cn","-","911310006013492757","911310006013492757","130000400002092","60134927-5","860","有限责任公司(中外合资)","电气机械和器材制造业","华北富士达电梯有限公司","河北省廊坊经济技术开发区春明道７号","河北省廊坊经济技术开发区春明道7号","www.fujitec.cn","许可项目：特种设备制造；特种设备设计；特种设备安装改造修理；特种设备检验检测。（依法须经批准的项目，经相关部门批准后方可开展经营活动，具体经营项目以相关部门批准文件或许可证件为准）一般项目：特种设备销售；通用设备制造（不含特种设备制造）；机械电气设备制造；通用零部件制造；机械零件、零部件加工；机械设备销售；机械电气设备销售；机械零件、零部件销售；销售代理；普通机械设备安装服务；电气设备修理；通用设备修理；电子、机械设备维护（不含特种设备）；技术服务、技术开发、技术咨询、技术交流、技术转让、技术推广。（除依法须经批准的项目外，凭营业执照依法自主开展经营活动）","成功"
"合肥恒久建设工程有限责任公司","开业","倪有恒","42980000","8000000","22/7/2010 00:00:00","21/7/2023 00:00:00","-","安徽省","合肥市","肥西县","13905606156","0551-68269678,0551-68848457,13955113776,0551-68850035","307733040@qq.com","1808019516@qq.com,1292892675@qq.com","9134012355921398XA","9134012355921398XA","340123000052966","55921398-X","10","有限责任公司(自然人投资或控股)","房屋建筑业","-","安徽省合肥市肥西县官亭镇王集路C11西001号","安徽省合肥市肥西县官亭镇王集路C11西001号","-","房屋建筑工程；市政工程；装饰装修工程施工与设计；园林绿化工程施工；苗木培植、销售；园林花卉培育、租赁；水利水电工程；建筑智能设计及施工；桥梁工程；体育场地工程；钢结构工程；门窗工程；消防设施安装工程；防腐、防水、保温工程；园林古建筑工程；环保工程；城市及道路照明、亮化工程；房屋修缮；清扫保洁；道路保洁；房屋拆迁（拆除）；交通标志标识工程；标识标牌设计与制作；管道非开挖修复；物业服务；建筑劳务分包；顶管工程；苗木培育与销售。（依法须经批准的项目，经相关部门批准后方可开展经营活动）","成功"
"安徽鼎晖建设工程有限公司","开业","纪明宗","67890000","2000000","23/1/2014 00:00:00","22/8/2022 00:00:00","-","安徽省","合肥市","肥东县","17505516685","0556-8931069,0556-8978928,0551-62875977,18756087732,18697500921","348025117@qq.com","-","9134010009079822XQ","9134010009079822XQ","340100000901725","09079822-X","38","有限责任公司(自然人投资或控股)","房屋建筑业","-","合肥市肥东县包公镇政府办公楼430室","合肥市肥东县包公镇政府办公楼430室","-","建筑工程施工总承包；公路工程、桥梁工程、电力工程、机电工程、地质灾害治理工程、园林绿化工程、市政公用工程、水利工程、环保、节能与防腐工程、外墙保温工程、公路交通工程、公路路面工程、公路路基工程、城市道路照明工程、体育场地设施工程、房屋修缮工程、结构补强工程、建筑物纠偏和平移工程、钢结构工程、地基基础工程、消防设施工程、古建筑工程、实验室通风及供气工程、自动化控制工程、洁净净化工程、恒温恒湿工程、辐射防护、磁屏蔽工程施工；园林景观、雕塑设计及施工；室内外装饰装修、建筑智能化、安全技术防范工程、实验室整体建设设计与施工；金属门窗、机电设备、标牌、灯箱安装；广告设计、制作、发布；计算机系统集成；展会设计、制作、布展；房屋拆迁、拆除；清扫保洁；护栏、交通设施销售、安装；施工劳务分包；建材、石材销售。（依法须经批准的项目，经相关部门批准后方可开展经营活动）","成功"
"合肥市规划设计研究院;安徽省金田建筑设计咨询有限责任公司","-","-","0","0","1/1/1970 00:00:00","1/1/1970 00:00:00","-","-","-","-","-","-","-","-","-","-","-","-","-","-","-","-","-","-","-","-","失败"
"安徽省新同济工程咨询集团有限公司","开业","吴志昂","30000000","11500000","4/3/2003 00:00:00","9/1/2023 00:00:00","-","安徽省","合肥市","包河区","0556-6122887","18055401911,13866029722,0551-63629541,13966623779,13909630961","2927877915@qq.com","42774586@qq.com,2457156551@qq.com,1010297279@qq.com","91340100746790272T","91340100746790272T","340000000003381","74679027-2","98","有限责任公司(自然人投资或控股)","公共设施管理业","-","合肥市包河区繁华大道5055号联东U谷53-2幢","合肥市包河区繁华大道5055号联东U谷53-2幢","www.ahxtj.com","许可项目：建设工程勘察；建设工程设计；测绘服务；建设工程监理；文物保护工程施工；地质灾害治理工程施工；建筑劳务分包；施工专业作业；建设工程施工；水利工程建设监理；路基路面养护作业；公路管理与养护；地质灾害危险性评估；安全评价业务；公路工程监理；水运工程监理；文物保护工程监理；单建式人防工程监理（依法须经批准的项目，经相关部门批准后方可开展经营活动）一般项目：工程管理服务；政府采购代理服务；工程造价咨询业务；工程技术服务（规划管理、勘察、设计、监理除外）；水土流失防治服务；水利相关咨询服务；水环境污染防治服务；安全咨询服务；机械设备租赁；建筑材料销售；土石方工程施工；园林绿化工程施工；信息技术咨询服务；环保咨询服务（除许可业务外，可自主依法经营法律法规非禁止或限制的项目）","成功"
"安徽省建科建设监理有限公司","开业","陈贤亮","11000000","11000000","20/9/2000 00:00:00","20/6/2023 00:00:00","-","安徽省","合肥市","蜀山区","15856480030","18792009007,0551-63635266,0551-2632472,18005691239,0551-62638494","2695964180@qq.com","ahjkjl@126.com,anjkjl@126.com","91340000723314521C","91340000723314521C","340000000022527","72331452-1","319","有限责任公司(非自然人投资或控股的法人独资)","专业技术服务业","-","安徽省合肥市蜀山区山湖路567号","安徽省合肥市蜀山区山湖路567号","-","许可项目：建设工程监理；公路工程监理；水利工程建设监理；单建式人防工程监理（依法须经批准的项目，经相关部门批准后方可开展经营活动）一般项目：工程管理服务；工程造价咨询业务（除许可业务外，可自主依法经营法律法规非禁止或限制的项目）","成功"
"安徽求是工程建设咨询有限公司","开业","洪从胜","12000000","10000000","5/4/2006 00:00:00","29/3/2024 00:00:00","-","安徽省","合肥市","瑶海区","0557-3049266","15385536931,18715152180,18655025801,0551-82626081,15955071598","-","-","91341302786528113C","91341302786528113C","341300000006590","78652811-3","84","有限责任公司(自然人投资或控股)","商务服务业","-","安徽省合肥市新站区学府路1516号合肥智慧产业园A15＃楼702室","安徽省合肥市新站区学府路1516号合肥智慧产业园A15＃楼702室","www.ahqs.com.cn","工程招标代理、工程建设项目管理咨询服务、政府采购代理、货物采购招标代理、工程造价咨询、工程造价纠纷鉴定、工程设计、工程监理、人民防空工程监理、文物保护工程监理、地质灾害防治治理、工程测量、水文地质勘查、建筑材料（不含石料及危险化学品）加工、园林绿化工程施工、公路工程及养护、水利水电工程、房屋建筑工程、市政工程、土石方工程、交通工程、照明及亮化工程、建筑装饰装修工程、钢结构工程、环保工程、桥梁工程、隧道工程、机电安装工程、古建筑工程、地基基础工程、公路路面工程、公路路基工程、公路交通工程设施、地质灾害施工、文物工程施工、工程试验检测、道路建筑材料（不含石料）加工、体育场施工、防水防腐保温工程、石油化工工程、河湖整治工程、堤防工程、水工大坝工程、输变电工程（不含承装（修、试）电力设施）、通信工程、大棚制作安装及配套加工销售、特种专业工程（不含特种设备）、建筑幕墙工程、电子智能化工程、消防设施工程设计及施工、建筑数学模型技术开发、展览陈列工程设计及施工、雕塑设计及施工、施工劳务（不含劳务派遣）、物业管理、卫生保洁、广告标牌、房屋拆除（不含爆破）、档案资料整理。（依法须经批准的项目，经相关部门批准后方可开展经营活动）","成功"
"安徽省建设监理有限公司","开业","朱仁芳","20000000","6000000","19/8/1993 00:00:00","13/3/2023 00:00:00","-","安徽省","安徽省","安徽省","13805643501","0551-82392519,13866161088,0551-3665858,13855898171,0559-4232813","acs_china@126.com","-","91340000148947612F","91340000148947612F","340000000004446","14894761-2","694","有限责任公司(自然人投资或控股)","商务服务业","安徽省建设监理公司","安徽省合肥市包河区徽州大道6669号高速滨湖时代广场C8栋2101","安徽省合肥市包河区徽州大道6669号高速滨湖时代广场C8栋2101","acsc.com.cn","建设监理(综合);工程招标代理;工程造价咨询(乙级);工程建设监理有关规划、设计、施工、设备配套,技术咨询、技术开发。","成功"
